"type","id","created","modified","external_references","object_marking_refs","name","x_mitre_version","created_by_ref","description","spec_version","x_mitre_attack_spec_version","x_mitre_domains","x_mitre_modified_by_ref"
"course-of-action","course-of-action--12c13879-b7bd-4bc5-8def-aacec386d432","2018-10-17T00:14:20.652Z","2018-10-17T00:14:20.652Z","[{'url': 'https://attack.mitre.org/techniques/T1117', 'source_name': 'mitre-attack', 'external_id': 'T1117'}, {'url': 'https://github.com/iadgov/Secure-Host-Baseline/tree/master/EMET', 'source_name': 'Secure Host Baseline EMET', 'description': 'National Security Agency. (2016, May 4). Secure Host Baseline EMET. Retrieved June 22, 2016.'}]","['marking-definition--fa42a846-8d90-4e51-bc29-71d5b4802168']","Regsvr32 Mitigation","1.0","identity--c78cb6e5-0c4b-4611-8297-d1b8b55e40b5","Microsoft's Enhanced Mitigation Experience Toolkit (EMET) Attack Surface Reduction (ASR) feature can be used to block regsvr32.exe from being used to bypass whitelisting. (Citation: Secure Host Baseline EMET)","2.1","2.1.0","['enterprise-attack']","identity--c78cb6e5-0c4b-4611-8297-d1b8b55e40b5"
"course-of-action","course-of-action--af093bc8-7b59-4e2a-9da8-8e839b4c50c6","2018-10-17T00:14:20.652Z","2018-10-17T00:14:20.652Z","[{'url': 'https://attack.mitre.org/techniques/T1219', 'source_name': 'mitre-attack', 'external_id': 'T1219'}]","['marking-definition--fa42a846-8d90-4e51-bc29-71d5b4802168']","Remote Access Tools Mitigation","1.0","identity--c78cb6e5-0c4b-4611-8297-d1b8b55e40b5","Properly configure firewalls, application firewalls, and proxies to limit outgoing traffic to sites and services used by remote access tools.

Network intrusion detection and prevention systems that use network signatures may be able to prevent traffic to these services as well.

Use application whitelisting to mitigate use of and installation of unapproved software.","2.1","2.1.0","['enterprise-attack']","identity--c78cb6e5-0c4b-4611-8297-d1b8b55e40b5"
"course-of-action","course-of-action--53b3b027-bed3-480c-9101-1247047d0fe6","2018-10-17T00:14:20.652Z","2018-10-17T00:14:20.652Z","[{'url': 'https://attack.mitre.org/techniques/T1076', 'source_name': 'mitre-attack', 'external_id': 'T1076'}, {'url': 'https://security.berkeley.edu/node/94', 'source_name': 'Berkley Secure', 'description': 'Berkeley Security, University of California. (n.d.). Securing Remote Desktop for System Administrators. Retrieved November 4, 2014.'}, {'url': 'https://technet.microsoft.com/en-us/library/cc754272(v=ws.11).aspx', 'source_name': 'Windows RDP Sessions', 'description': 'Microsoft. (n.d.). Configure Timeout and Reconnection Settings for Remote Desktop Services Sessions. Retrieved December 11, 2017.'}]","['marking-definition--fa42a846-8d90-4e51-bc29-71d5b4802168']","Remote Desktop Protocol Mitigation","1.0","identity--c78cb6e5-0c4b-4611-8297-d1b8b55e40b5","Disable the RDP service if it is unnecessary, remove unnecessary accounts and groups from Remote Desktop Users groups, and enable firewall rules to block RDP traffic between network security zones. Audit the Remote Desktop Users group membership regularly. Remove the local Administrators group from the list of groups allowed to log in through RDP. Limit remote user permissions if remote access is necessary. Use remote desktop gateways and multifactor authentication for remote logins. (Citation: Berkley Secure) Do not leave RDP accessible from the internet. Change GPOs to define shorter timeouts sessions and maximum amount of time any single session can be active. Change GPOs to specify the maximum amount of time that a disconnected session stays active on the RD session host server. (Citation: Windows RDP Sessions)","2.1","2.1.0","['enterprise-attack']","identity--c78cb6e5-0c4b-4611-8297-d1b8b55e40b5"
"course-of-action","course-of-action--cdecc44a-1dbf-4c1f-881c-f21e3f47272a","2018-10-17T00:14:20.652Z","2018-10-17T00:14:20.652Z","[{'url': 'https://attack.mitre.org/techniques/T1105', 'source_name': 'mitre-attack', 'external_id': 'T1105'}, {'url': 'https://arxiv.org/ftp/arxiv/papers/1408/1408.1136.pdf', 'source_name': 'University of Birmingham C2', 'description': 'Gardiner, J.,  Cova, M., Nagaraja, S. (2014, February). Command & Control Understanding, Denying and Detecting. Retrieved April 20, 2016.'}]","['marking-definition--fa42a846-8d90-4e51-bc29-71d5b4802168']","Remote File Copy Mitigation","1.0","identity--c78cb6e5-0c4b-4611-8297-d1b8b55e40b5","Network intrusion detection and prevention systems that use network signatures to identify traffic for specific adversary malware or unusual data transfer over known tools and protocols like FTP can be used to mitigate activity at the network level. Signatures are often for unique indicators within protocols and may be based on the specific obfuscation technique used by a particular adversary or tool, and will likely be different across various malware families and versions. Adversaries will likely change tool C2 signatures over time or construct protocols in such a way as to avoid detection by common defensive tools. (Citation: University of Birmingham C2)","2.1","2.1.0","['enterprise-attack']","identity--c78cb6e5-0c4b-4611-8297-d1b8b55e40b5"
"course-of-action","course-of-action--979e6485-7a2f-42bd-ae96-4e622c3cd173","2018-10-17T00:14:20.652Z","2018-10-17T00:14:20.652Z","[{'url': 'https://attack.mitre.org/techniques/T1021', 'source_name': 'mitre-attack', 'external_id': 'T1021'}]","['marking-definition--fa42a846-8d90-4e51-bc29-71d5b4802168']","Remote Services Mitigation","1.0","identity--c78cb6e5-0c4b-4611-8297-d1b8b55e40b5","Limit the number of accounts that may use remote services. Use multifactor authentication where possible. Limit the permissions for accounts that are at higher risk of compromise; for example, configure SSH so users can only run specific programs. Prevent Credential Access techniques that may allow an adversary to acquire [Valid Accounts](T1078) that can be used by existing services.","2.1","2.1.0","['enterprise-attack']","identity--c78cb6e5-0c4b-4611-8297-d1b8b55e40b5"
"course-of-action","course-of-action--9a902722-cecd-4fbe-a6c9-49333aa0f8c2","2018-10-17T00:14:20.652Z","2018-10-17T00:14:20.652Z","[{'url': 'https://attack.mitre.org/techniques/T1018', 'source_name': 'mitre-attack', 'external_id': 'T1018'}, {'url': 'http://www.sans.org/reading-room/whitepapers/application/application-whitelisting-panacea-propaganda-33599', 'source_name': 'Beechey 2010', 'description': 'Beechey, J. (2010, December). Application Whitelisting: Panacea or Propaganda?. Retrieved November 18, 2014.'}, {'url': 'http://blog.jpcert.or.jp/2016/01/windows-commands-abused-by-attackers.html', 'source_name': 'Windows Commands JPCERT', 'description': 'Tomonaga, S. (2016, January 26). Windows Commands Abused by Attackers. Retrieved February 2, 2016.'}, {'url': 'https://www.iad.gov/iad/library/ia-guidance/tech-briefs/application-whitelisting-using-microsoft-applocker.cfm', 'source_name': 'NSA MS AppLocker', 'description': 'NSA Information Assurance Directorate. (2014, August). Application Whitelisting Using Microsoft AppLocker. Retrieved March 31, 2016.'}, {'url': 'http://technet.microsoft.com/en-us/magazine/2008.06.srp.aspx', 'source_name': 'Corio 2008', 'description': 'Corio, C., & Sayana, D. P. (2008, June). Application Lockdown with Software Restriction Policies. Retrieved November 18, 2014.'}, {'url': 'https://technet.microsoft.com/en-us/library/ee791851.aspx', 'source_name': 'TechNet Applocker vs SRP', 'description': 'Microsoft. (2012, June 27). Using Software Restriction Policies and AppLocker Policies. Retrieved April 7, 2016.'}]","['marking-definition--fa42a846-8d90-4e51-bc29-71d5b4802168']","Remote System Discovery Mitigation","1.0","identity--c78cb6e5-0c4b-4611-8297-d1b8b55e40b5","Identify unnecessary system utilities or potentially malicious software that may be used to acquire information on remotely available systems, and audit and/or block them by using whitelisting (Citation: Beechey 2010) tools, like AppLocker, (Citation: Windows Commands JPCERT) (Citation: NSA MS AppLocker) or Software Restriction Policies (Citation: Corio 2008) where appropriate. (Citation: TechNet Applocker vs SRP)","2.1","2.1.0","['enterprise-attack']","identity--c78cb6e5-0c4b-4611-8297-d1b8b55e40b5"
"course-of-action","course-of-action--effb83a0-ead1-4b36-b7f6-b7bdf9c4616e","2018-10-17T00:14:20.652Z","2018-10-17T00:14:20.652Z","[{'url': 'https://attack.mitre.org/techniques/T1091', 'source_name': 'mitre-attack', 'external_id': 'T1091'}, {'url': 'https://support.microsoft.com/en-us/kb/967715', 'source_name': 'Microsoft Disable Autorun', 'description': 'Microsoft. (n.d.). How to disable the Autorun functionality in Windows. Retrieved April 20, 2016.'}, {'url': 'https://technet.microsoft.com/en-us/library/cc772540(v=ws.10).aspx', 'source_name': 'TechNet Removable Media Control', 'description': 'Microsoft. (2007, August 31). https://technet.microsoft.com/en-us/library/cc771759(v=ws.10).aspx. Retrieved April 20, 2016.'}, {'url': 'http://www.sans.org/reading-room/whitepapers/application/application-whitelisting-panacea-propaganda-33599', 'source_name': 'Beechey 2010', 'description': 'Beechey, J. (2010, December). Application Whitelisting: Panacea or Propaganda?. Retrieved November 18, 2014.'}, {'url': 'http://blog.jpcert.or.jp/2016/01/windows-commands-abused-by-attackers.html', 'source_name': 'Windows Commands JPCERT', 'description': 'Tomonaga, S. (2016, January 26). Windows Commands Abused by Attackers. Retrieved February 2, 2016.'}, {'url': 'https://www.iad.gov/iad/library/ia-guidance/tech-briefs/application-whitelisting-using-microsoft-applocker.cfm', 'source_name': 'NSA MS AppLocker', 'description': 'NSA Information Assurance Directorate. (2014, August). Application Whitelisting Using Microsoft AppLocker. Retrieved March 31, 2016.'}, {'url': 'http://technet.microsoft.com/en-us/magazine/2008.06.srp.aspx', 'source_name': 'Corio 2008', 'description': 'Corio, C., & Sayana, D. P. (2008, June). Application Lockdown with Software Restriction Policies. Retrieved November 18, 2014.'}, {'url': 'https://technet.microsoft.com/en-us/library/ee791851.aspx', 'source_name': 'TechNet Applocker vs SRP', 'description': 'Microsoft. (2012, June 27). Using Software Restriction Policies and AppLocker Policies. Retrieved April 7, 2016.'}]","['marking-definition--fa42a846-8d90-4e51-bc29-71d5b4802168']","Replication Through Removable Media Mitigation","1.0","identity--c78cb6e5-0c4b-4611-8297-d1b8b55e40b5","Disable Autorun if it is unnecessary. (Citation: Microsoft Disable Autorun) Disallow or restrict removable media at an organizational policy level if it is not required for business operations. (Citation: TechNet Removable Media Control)

Identify potentially malicious software that may be used to infect removable media or may result from tainted removable media, and audit and/or block it by using whitelisting (Citation: Beechey 2010) tools, like AppLocker, (Citation: Windows Commands JPCERT) (Citation: NSA MS AppLocker) or Software Restriction Policies (Citation: Corio 2008) where appropriate. (Citation: TechNet Applocker vs SRP)","2.1","2.1.0","['enterprise-attack']","identity--c78cb6e5-0c4b-4611-8297-d1b8b55e40b5"
"course-of-action","course-of-action--46acc565-11aa-40ba-b629-33ba0ab9b07b","2019-04-24T16:59:33.603Z","2019-04-24T16:59:33.603Z","[{'external_id': 'T1496', 'source_name': 'mitre-attack', 'url': 'https://attack.mitre.org/techniques/T1496'}, {'url': 'http://www.sans.org/reading-room/whitepapers/application/application-whitelisting-panacea-propaganda-33599', 'source_name': 'Beechey 2010', 'description': 'Beechey, J. (2010, December). Application Whitelisting: Panacea or Propaganda?. Retrieved November 18, 2014.'}, {'url': 'http://blog.jpcert.or.jp/2016/01/windows-commands-abused-by-attackers.html', 'source_name': 'Windows Commands JPCERT', 'description': 'Tomonaga, S. (2016, January 26). Windows Commands Abused by Attackers. Retrieved February 2, 2016.'}, {'url': 'https://www.iad.gov/iad/library/ia-guidance/tech-briefs/application-whitelisting-using-microsoft-applocker.cfm', 'source_name': 'NSA MS AppLocker', 'description': 'NSA Information Assurance Directorate. (2014, August). Application Whitelisting Using Microsoft AppLocker. Retrieved March 31, 2016.'}, {'url': 'http://technet.microsoft.com/en-us/magazine/2008.06.srp.aspx', 'source_name': 'Corio 2008', 'description': 'Corio, C., & Sayana, D. P. (2008, June). Application Lockdown with Software Restriction Policies. Retrieved November 18, 2014.'}, {'url': 'https://technet.microsoft.com/en-us/library/ee791851.aspx', 'source_name': 'TechNet Applocker vs SRP', 'description': 'Microsoft. (2012, June 27). Using Software Restriction Policies and AppLocker Policies. Retrieved April 7, 2016.'}]","['marking-definition--fa42a846-8d90-4e51-bc29-71d5b4802168']","Resource Hijacking Mitigation","1.0","identity--c78cb6e5-0c4b-4611-8297-d1b8b55e40b5","Identify potentially malicious software and audit and/or block it by using whitelisting(Citation: Beechey 2010) tools, like AppLocker,(Citation: Windows Commands JPCERT)(Citation: NSA MS AppLocker) or Software Restriction Policies(Citation: Corio 2008) where appropriate.(Citation: TechNet Applocker vs SRP)","2.1","2.1.0","['enterprise-attack']","identity--c78cb6e5-0c4b-4611-8297-d1b8b55e40b5"
"course-of-action","course-of-action--95ddb356-7ba0-4bd9-a889-247262b8946f","2018-10-17T00:14:20.652Z","2018-10-17T00:14:20.652Z","[{'url': 'https://attack.mitre.org/techniques/T1014', 'source_name': 'mitre-attack', 'external_id': 'T1014'}, {'url': 'http://www.sans.org/reading-room/whitepapers/application/application-whitelisting-panacea-propaganda-33599', 'source_name': 'Beechey 2010', 'description': 'Beechey, J. (2010, December). Application Whitelisting: Panacea or Propaganda?. Retrieved November 18, 2014.'}, {'url': 'http://blog.jpcert.or.jp/2016/01/windows-commands-abused-by-attackers.html', 'source_name': 'Windows Commands JPCERT', 'description': 'Tomonaga, S. (2016, January 26). Windows Commands Abused by Attackers. Retrieved February 2, 2016.'}, {'url': 'https://www.iad.gov/iad/library/ia-guidance/tech-briefs/application-whitelisting-using-microsoft-applocker.cfm', 'source_name': 'NSA MS AppLocker', 'description': 'NSA Information Assurance Directorate. (2014, August). Application Whitelisting Using Microsoft AppLocker. Retrieved March 31, 2016.'}, {'url': 'http://technet.microsoft.com/en-us/magazine/2008.06.srp.aspx', 'source_name': 'Corio 2008', 'description': 'Corio, C., & Sayana, D. P. (2008, June). Application Lockdown with Software Restriction Policies. Retrieved November 18, 2014.'}, {'url': 'https://technet.microsoft.com/en-us/library/ee791851.aspx', 'source_name': 'TechNet Applocker vs SRP', 'description': 'Microsoft. (2012, June 27). Using Software Restriction Policies and AppLocker Policies. Retrieved April 7, 2016.'}]","['marking-definition--fa42a846-8d90-4e51-bc29-71d5b4802168']","Rootkit Mitigation","1.0","identity--c78cb6e5-0c4b-4611-8297-d1b8b55e40b5","Identify potentially malicious software that may contain rootkit functionality, and audit and/or block it by using whitelisting (Citation: Beechey 2010) tools, like AppLocker, (Citation: Windows Commands JPCERT) (Citation: NSA MS AppLocker) or Software Restriction Policies (Citation: Corio 2008) where appropriate. (Citation: TechNet Applocker vs SRP)","2.1","2.1.0","['enterprise-attack']","identity--c78cb6e5-0c4b-4611-8297-d1b8b55e40b5"
"course-of-action","course-of-action--8c918d8a-11c5-4ffd-af10-e74bc06bdfae","2018-10-17T00:14:20.652Z","2018-10-17T00:14:20.652Z","[{'url': 'https://attack.mitre.org/techniques/T1085', 'source_name': 'mitre-attack', 'external_id': 'T1085'}, {'url': 'https://github.com/iadgov/Secure-Host-Baseline/tree/master/EMET', 'source_name': 'Secure Host Baseline EMET', 'description': 'National Security Agency. (2016, May 4). Secure Host Baseline EMET. Retrieved June 22, 2016.'}]","['marking-definition--fa42a846-8d90-4e51-bc29-71d5b4802168']","Rundll32 Mitigation","1.0","identity--c78cb6e5-0c4b-4611-8297-d1b8b55e40b5","Microsoft's Enhanced Mitigation Experience Toolkit (EMET) Attack Surface Reduction (ASR) feature can be used to block methods of using rundll32.exe to bypass whitelisting. (Citation: Secure Host Baseline EMET)","2.1","2.1.0","['enterprise-attack']","identity--c78cb6e5-0c4b-4611-8297-d1b8b55e40b5"
"course-of-action","course-of-action--337172b1-b003-4034-8a3f-1d89a71da628","2019-04-12T14:59:36.522Z","2019-04-26T16:45:43.591Z","[{'external_id': 'T1494', 'source_name': 'mitre-attack', 'url': 'https://attack.mitre.org/techniques/T1494'}, {'url': 'http://www.sans.org/reading-room/whitepapers/application/application-whitelisting-panacea-propaganda-33599', 'source_name': 'Beechey 2010', 'description': 'Beechey, J. (2010, December). Application Whitelisting: Panacea or Propaganda?. Retrieved November 18, 2014.'}, {'url': 'http://blog.jpcert.or.jp/2016/01/windows-commands-abused-by-attackers.html', 'source_name': 'Windows Commands JPCERT', 'description': 'Tomonaga, S. (2016, January 26). Windows Commands Abused by Attackers. Retrieved February 2, 2016.'}, {'url': 'https://www.iad.gov/iad/library/ia-guidance/tech-briefs/application-whitelisting-using-microsoft-applocker.cfm', 'source_name': 'NSA MS AppLocker', 'description': 'NSA Information Assurance Directorate. (2014, August). Application Whitelisting Using Microsoft AppLocker. Retrieved March 31, 2016.'}, {'url': 'http://technet.microsoft.com/en-us/magazine/2008.06.srp.aspx', 'source_name': 'Corio 2008', 'description': 'Corio, C., & Sayana, D. P. (2008, June). Application Lockdown with Software Restriction Policies. Retrieved November 18, 2014.'}, {'url': 'https://technet.microsoft.com/en-us/library/ee791851.aspx', 'source_name': 'TechNet Applocker vs SRP', 'description': 'Microsoft. (2012, June 27). Using Software Restriction Policies and AppLocker Policies. Retrieved April 7, 2016.'}]","['marking-definition--fa42a846-8d90-4e51-bc29-71d5b4802168']","Runtime Data Manipulation Mitigation","1.0","identity--c78cb6e5-0c4b-4611-8297-d1b8b55e40b5","Identify critical business and system processes that may be targeted by adversaries and work to secure those systems against tampering. Prevent critical business and system processes from being replaced, overwritten, or reconfigured to load potentially malicious code. Identify potentially malicious software and audit and/or block it by using whitelisting(Citation: Beechey 2010) tools, like AppLocker,(Citation: Windows Commands JPCERT)(Citation: NSA MS AppLocker) or Software Restriction Policies(Citation: Corio 2008) where appropriate.(Citation: TechNet Applocker vs SRP)","2.1","2.1.0","['enterprise-attack']","identity--c78cb6e5-0c4b-4611-8297-d1b8b55e40b5"
"course-of-action","course-of-action--b91c2f9e-c1a0-44df-95f0-9e7c9d1d5e55","2018-10-17T00:14:20.652Z","2018-10-17T00:14:20.652Z","[{'url': 'https://attack.mitre.org/techniques/T1178', 'source_name': 'mitre-attack', 'external_id': 'T1178'}, {'url': 'https://msdn.microsoft.com/library/windows/desktop/aa379571.aspx', 'source_name': 'Microsoft SID', 'description': 'Microsoft. (n.d.). Security Identifiers. Retrieved November 30, 2017.'}, {'url': 'https://technet.microsoft.com/library/cc794757.aspx', 'source_name': 'Microsoft SID Filtering Quarantining Jan 2009', 'description': 'Microsoft. (n.d.). Configuring SID Filter Quarantining on External Trusts. Retrieved November 30, 2017.'}, {'url': 'https://technet.microsoft.com/library/cc835085.aspx', 'source_name': 'Microsoft Netdom Trust Sept 2012', 'description': 'Microsoft. (2012, September 11). Command-Line Reference - Netdom Trust. Retrieved November 30, 2017.'}, {'url': 'https://technet.microsoft.com/library/cc755321.aspx', 'source_name': 'Microsoft Trust Considerations Nov 2014', 'description': 'Microsoft. (2014, November 19). Security Considerations for Trusts. Retrieved November 30, 2017.'}, {'url': 'https://adsecurity.org/?p=1640', 'source_name': 'AdSecurity Kerberos GT Aug 2015', 'description': 'Metcalf, S. (2015, August 7). Kerberos Golden Tickets are Now More Golden. Retrieved December 1, 2017.'}]","['marking-definition--fa42a846-8d90-4e51-bc29-71d5b4802168']","SID-History Injection Mitigation","1.0","identity--c78cb6e5-0c4b-4611-8297-d1b8b55e40b5","Clean up SID-History attributes after legitimate account migration is complete.

Consider applying SID Filtering to interforest trusts, such as forest trusts and external trusts, to exclude SID-History from requests to access domain resources. SID Filtering ensures that any authentication requests over a trust only contain SIDs of security principals from the trusted domain (i.e. preventing the trusted domain from claiming a user has membership in groups outside of the domain).

SID Filtering of forest trusts is enabled by default, but may have been disabled in some cases to allow a child domain to transitively access forest trusts. SID Filtering of external trusts is automatically enabled on all created external trusts using Server 2003 or later domain controllers. (Citation: Microsoft Trust Considerations Nov 2014) (Citation: Microsoft SID Filtering Quarantining Jan 2009) However note that SID Filtering is not automatically applied to legacy trusts or may have been deliberately disabled to allow inter-domain access to resources.

SID Filtering can be applied by: (Citation: Microsoft Netdom Trust Sept 2012)

* Disabling SIDHistory on forest trusts using the netdom tool (`netdom trust <TrustingDomainName> /domain:<TrustedDomainName> /EnableSIDHistory:no` on the domain controller). 
* Applying SID Filter Quarantining to external trusts using the netdom tool (`netdom trust <TrustingDomainName> /domain:<TrustedDomainName> /quarantine:yes` on the domain controller)
Applying SID Filtering to domain trusts within a single forest is not recommended as it is an unsupported configuration and can cause breaking changes. (Citation: Microsoft Netdom Trust Sept 2012) (Citation: AdSecurity Kerberos GT Aug 2015) If a domain within a forest is untrustworthy then it should not be a member of the forest. In this situation it is necessary to first split the trusted and untrusted domains into separate forests where SID Filtering can be applied to an interforest trust.","2.1","2.1.0","['enterprise-attack']","identity--c78cb6e5-0c4b-4611-8297-d1b8b55e40b5"
"course-of-action","course-of-action--ef273807-c465-4728-9cee-5823422f42ee","2018-10-17T00:14:20.652Z","2018-10-17T00:14:20.652Z","[{'url': 'https://attack.mitre.org/techniques/T1198', 'source_name': 'mitre-attack', 'external_id': 'T1198'}, {'url': 'https://specterops.io/assets/resources/SpecterOps_Subverting_Trust_in_Windows.pdf', 'source_name': 'SpectorOps Subverting Trust Sept 2017', 'description': 'Graeber, M. (2017, September). Subverting Trust in Windows. Retrieved January 31, 2018.'}]","['marking-definition--fa42a846-8d90-4e51-bc29-71d5b4802168']","SIP and Trust Provider Hijacking Mitigation","1.0","identity--c78cb6e5-0c4b-4611-8297-d1b8b55e40b5","Ensure proper permissions are set for Registry hives to prevent users from modifying keys related to SIP and trust provider components. Also ensure that these values contain their full path to prevent [DLL Search Order Hijacking](T1038). (Citation: SpectorOps Subverting Trust Sept 2017)

Consider removing unnecessary and/or stale SIPs. (Citation: SpectorOps Subverting Trust Sept 2017)

Restrict storage and execution of SIP DLLs to protected directories, such as C:\Windows, rather than user directories.

Enable whitelisting solutions such as AppLocker and/or Device Guard to block the loading of malicious SIP DLLs. Components may still be able to be hijacked to suitable functions already present on disk if malicious modifications to Registry keys are not prevented.","2.1","2.1.0","['enterprise-attack']","identity--c78cb6e5-0c4b-4611-8297-d1b8b55e40b5"
"course-of-action","course-of-action--41cff8e9-fd05-408e-b3d5-d98c54c20bcf","2018-10-17T00:14:20.652Z","2018-10-17T00:14:20.652Z","[{'url': 'https://attack.mitre.org/techniques/T1184', 'source_name': 'mitre-attack', 'external_id': 'T1184'}, {'url': 'https://www.symantec.com/connect/articles/ssh-and-ssh-agent', 'source_name': 'Symantec SSH and ssh-agent', 'description': 'Hatch, B. (2004, November 22). SSH and ssh-agent. Retrieved January 8, 2018.'}]","['marking-definition--fa42a846-8d90-4e51-bc29-71d5b4802168']","SSH Hijacking Mitigation","1.0","identity--c78cb6e5-0c4b-4611-8297-d1b8b55e40b5","Ensure SSH key pairs have strong passwords and refrain from using key-store technologies such as ssh-agent unless they are properly protected. Ensure that all private keys are stored securely in locations where only the legitimate owner has access to with strong passwords and are rotated frequently. Ensure proper file permissions are set and harden system to prevent root privilege escalation opportunities. Do not allow remote access via SSH as root or other privileged accounts. Ensure that agent forwarding is disabled on systems that do not explicitly require this feature to prevent misuse. (Citation: Symantec SSH and ssh-agent)","2.1","2.1.0","['enterprise-attack']","identity--c78cb6e5-0c4b-4611-8297-d1b8b55e40b5"
