"type","id","created","modified","external_references","object_marking_refs","name","x_mitre_version","created_by_ref","description","spec_version","x_mitre_attack_spec_version","x_mitre_domains","x_mitre_modified_by_ref"
"course-of-action","course-of-action--da8a87d2-946d-4c34-9a30-709058b98996","2018-10-17T00:14:20.652Z","2018-10-17T00:14:20.652Z","[{'url': 'https://attack.mitre.org/techniques/T1056', 'source_name': 'mitre-attack', 'external_id': 'T1056'}, {'url': 'http://www.sans.org/reading-room/whitepapers/application/application-whitelisting-panacea-propaganda-33599', 'source_name': 'Beechey 2010', 'description': 'Beechey, J. (2010, December). Application Whitelisting: Panacea or Propaganda?. Retrieved November 18, 2014.'}, {'url': 'http://technet.microsoft.com/en-us/magazine/2008.06.srp.aspx', 'source_name': 'Corio 2008', 'description': 'Corio, C., & Sayana, D. P. (2008, June). Application Lockdown with Software Restriction Policies. Retrieved November 18, 2014.'}, {'url': 'https://www.iad.gov/iad/library/ia-guidance/tech-briefs/application-whitelisting-using-microsoft-applocker.cfm', 'source_name': 'NSA MS AppLocker', 'description': 'NSA Information Assurance Directorate. (2014, August). Application Whitelisting Using Microsoft AppLocker. Retrieved March 31, 2016.'}, {'url': 'https://technet.microsoft.com/en-us/library/ee791851.aspx', 'source_name': 'TechNet Applocker vs SRP', 'description': 'Microsoft. (2012, June 27). Using Software Restriction Policies and AppLocker Policies. Retrieved April 7, 2016.'}, {'url': 'http://blog.jpcert.or.jp/2016/01/windows-commands-abused-by-attackers.html', 'source_name': 'Windows Commands JPCERT', 'description': 'Tomonaga, S. (2016, January 26). Windows Commands Abused by Attackers. Retrieved February 2, 2016.'}]","['marking-definition--fa42a846-8d90-4e51-bc29-71d5b4802168']","Input Capture Mitigation","1.0","identity--c78cb6e5-0c4b-4611-8297-d1b8b55e40b5","Identify and block potentially malicious software that may be used to acquire credentials or information from the user by using whitelisting (Citation: Beechey 2010) tools, like AppLocker, (Citation: Windows Commands JPCERT) (Citation: NSA MS AppLocker) or Software Restriction Policies (Citation: Corio 2008) where appropriate. (Citation: TechNet Applocker vs SRP)

In cases where this behavior is difficult to detect or mitigate, efforts can be made to lessen some of the impact that might result from an adversary acquiring credential information. It is also good practice to follow mitigation recommendations for adversary use of [Valid Accounts](T1078).","2.1","2.1.0","['enterprise-attack']","identity--c78cb6e5-0c4b-4611-8297-d1b8b55e40b5"
"course-of-action","course-of-action--8a61f6b9-6b7a-4cf2-8e08-f1e26434f6df","2018-10-17T00:14:20.652Z","2019-03-12T17:12:47.281Z","[{'url': 'https://attack.mitre.org/techniques/T1141', 'source_name': 'mitre-attack', 'external_id': 'T1141'}]","['marking-definition--fa42a846-8d90-4e51-bc29-71d5b4802168']","Input Prompt Mitigation","1.0","identity--c78cb6e5-0c4b-4611-8297-d1b8b55e40b5","This technique exploits users' tendencies to always supply credentials when prompted, which makes it very difficult to mitigate. Use user training as a way to bring awareness and raise suspicion for potentially malicious events (ex: Office documents prompting for credentials).","2.1","2.1.0","['enterprise-attack']","identity--c78cb6e5-0c4b-4611-8297-d1b8b55e40b5"
"course-of-action","course-of-action--23061b40-a7b6-454f-8950-95d5ff80331c","2018-10-17T00:14:20.652Z","2018-10-17T00:14:20.652Z","[{'url': 'https://attack.mitre.org/techniques/T1130', 'source_name': 'mitre-attack', 'external_id': 'T1130'}, {'url': 'https://en.wikipedia.org/wiki/HTTP_Public_Key_Pinning', 'source_name': 'Wikipedia HPKP', 'description': 'Wikipedia. (2017, February 28). HTTP Public Key Pinning. Retrieved March 31, 2017.'}, {'url': 'https://posts.specterops.io/code-signing-certificate-cloning-attacks-and-defenses-6f98657fc6ec', 'source_name': 'SpectorOps Code Signing Dec 2017', 'description': 'Graeber, M. (2017, December 22). Code Signing Certificate Cloning Attacks and Defenses. Retrieved April 3, 2018.'}]","['marking-definition--fa42a846-8d90-4e51-bc29-71d5b4802168']","Install Root Certificate Mitigation","1.0","identity--c78cb6e5-0c4b-4611-8297-d1b8b55e40b5","HTTP Public Key Pinning (HPKP) is one method to mitigate potential man-in-the-middle situations where and adversary uses a mis-issued or fraudulent certificate to intercept encrypted communications by enforcing use of an expected certificate. (Citation: Wikipedia HPKP)

Windows Group Policy can be used to manage root certificates and the `Flags` value of `HKLM\SOFTWARE\Policies\Microsoft\SystemCertificates\Root\ProtectedRoots` can be set to 1 to prevent non-administrator users from making further root installations into their own HKCU certificate store. (Citation: SpectorOps Code Signing Dec 2017)","2.1","2.1.0","['enterprise-attack']","identity--c78cb6e5-0c4b-4611-8297-d1b8b55e40b5"
"course-of-action","course-of-action--ec418d1b-4963-439f-b055-f914737ef362","2018-10-17T00:14:20.652Z","2018-10-17T00:14:20.652Z","[{'url': 'https://attack.mitre.org/techniques/T1118', 'source_name': 'mitre-attack', 'external_id': 'T1118'}]","['marking-definition--fa42a846-8d90-4e51-bc29-71d5b4802168']","InstallUtil Mitigation","1.0","identity--c78cb6e5-0c4b-4611-8297-d1b8b55e40b5","InstallUtil may not be necessary within a given environment. Use application whitelisting configured to block execution of InstallUtil.exe if it is not required for a given system or network to prevent potential misuse by adversaries.","2.1","2.1.0","['enterprise-attack']","identity--c78cb6e5-0c4b-4611-8297-d1b8b55e40b5"
"course-of-action","course-of-action--a3e12b04-8598-4909-8855-2c97c1e7d549","2018-10-17T00:14:20.652Z","2018-10-17T00:14:20.652Z","[{'url': 'https://attack.mitre.org/techniques/T1208', 'source_name': 'mitre-attack', 'external_id': 'T1208'}, {'url': 'https://adsecurity.org/?p=2293', 'source_name': 'AdSecurity Cracking Kerberos Dec 2015', 'description': 'Metcalf, S. (2015, December 31). Cracking Kerberos TGS Tickets Using Kerberoast – Exploiting Kerberos to Compromise the Active Directory Domain. Retrieved March 22, 2018.'}]","['marking-definition--fa42a846-8d90-4e51-bc29-71d5b4802168']","Kerberoasting Mitigation","1.0","identity--c78cb6e5-0c4b-4611-8297-d1b8b55e40b5","Ensure strong password length (ideally 25+ characters) and complexity for service accounts and that these passwords periodically expire. (Citation: AdSecurity Cracking Kerberos Dec 2015) Also consider using Group Managed Service Accounts or another third party product such as password vaulting. (Citation: AdSecurity Cracking Kerberos Dec 2015)

Limit service accounts to minimal required privileges, including membership in privileged groups such as Domain Administrators. (Citation: AdSecurity Cracking Kerberos Dec 2015)

Enable AES Kerberos encryption (or another stronger encryption algorithm), rather than RC4, where possible. (Citation: AdSecurity Cracking Kerberos Dec 2015)","2.1","2.1.0","['enterprise-attack']","identity--c78cb6e5-0c4b-4611-8297-d1b8b55e40b5"
"course-of-action","course-of-action--44155d14-ca75-4fdf-b033-ab3d732e2884","2018-10-17T00:14:20.652Z","2018-10-17T00:14:20.652Z","[{'url': 'https://attack.mitre.org/techniques/T1215', 'source_name': 'mitre-attack', 'external_id': 'T1215'}, {'url': 'https://patchwork.kernel.org/patch/8754821/', 'source_name': 'Kernel.org Restrict Kernel Module', 'description': 'Vander Stoep, J. (2016, April 5). [v3] selinux: restrict kernel module loadinglogin  register. Retrieved April 9, 2018.'}, {'url': 'http://rkhunter.sourceforge.net', 'source_name': 'SourceForge rkhunter', 'description': 'Rootkit Hunter Project. (2018, February 20). The Rootkit Hunter project. Retrieved April 9, 2018.'}, {'url': 'http://www.chkrootkit.org/', 'source_name': 'Chkrootkit Main', 'description': 'Murilo, N., Steding-Jessen, K. (2017, August 23). Chkrootkit. Retrieved April 9, 2018.'}]","['marking-definition--fa42a846-8d90-4e51-bc29-71d5b4802168']","Kernel Modules and Extensions Mitigation","1.0","identity--c78cb6e5-0c4b-4611-8297-d1b8b55e40b5","Common tools for detecting Linux rootkits include: rkhunter (Citation: SourceForge rkhunter), chrootkit (Citation: Chkrootkit Main), although rootkits may be designed to evade certain detection tools.

LKMs and Kernel extensions require root level permissions to be installed. Limit access to the root account and prevent users from loading kernel modules and extensions through proper privilege separation and limiting Privilege Escalation opportunities.

Application whitelisting and software restriction tools, such as SELinux, can also aide in restricting kernel module loading. (Citation: Kernel.org Restrict Kernel Module)","2.1","2.1.0","['enterprise-attack']","identity--c78cb6e5-0c4b-4611-8297-d1b8b55e40b5"
"course-of-action","course-of-action--56648de3-8947-4559-90c4-eda10acc0f5a","2018-10-17T00:14:20.652Z","2018-10-17T00:14:20.652Z","[{'url': 'https://attack.mitre.org/techniques/T1142', 'source_name': 'mitre-attack', 'external_id': 'T1142'}]","['marking-definition--fa42a846-8d90-4e51-bc29-71d5b4802168']","Keychain Mitigation","1.0","identity--c78cb6e5-0c4b-4611-8297-d1b8b55e40b5","The password for the user's login keychain can be changed from the user's login password. This increases the complexity for an adversary because they need to know an additional password.","2.1","2.1.0","['enterprise-attack']","identity--c78cb6e5-0c4b-4611-8297-d1b8b55e40b5"
"course-of-action","course-of-action--77fd4d73-6b79-4593-82e7-e4a439cc7604","2018-10-17T00:14:20.652Z","2018-10-17T00:14:20.652Z","[{'url': 'https://attack.mitre.org/techniques/T1161', 'source_name': 'mitre-attack', 'external_id': 'T1161'}]","['marking-definition--fa42a846-8d90-4e51-bc29-71d5b4802168']","LC_LOAD_DYLIB Addition Mitigation","1.0","identity--c78cb6e5-0c4b-4611-8297-d1b8b55e40b5","Enforce that all binaries be signed by the correct Apple Developer IDs, and whitelist applications via known hashes. Binaries can also be baselined for what dynamic libraries they require, and if an app requires a new dynamic library that wasn’t included as part of an update, it should be investigated.","2.1","2.1.0","['enterprise-attack']","identity--c78cb6e5-0c4b-4611-8297-d1b8b55e40b5"
"course-of-action","course-of-action--6e7db820-9735-4545-bc64-039bc4ce354b","2018-10-17T00:14:20.652Z","2018-10-17T00:14:20.652Z","[{'url': 'https://attack.mitre.org/techniques/T1149', 'source_name': 'mitre-attack', 'external_id': 'T1149'}]","['marking-definition--fa42a846-8d90-4e51-bc29-71d5b4802168']","LC_MAIN Hijacking Mitigation","1.0","identity--c78cb6e5-0c4b-4611-8297-d1b8b55e40b5","Enforce valid digital signatures for signed code on all applications and only trust applications with signatures from trusted parties.","2.1","2.1.0","['enterprise-attack']","identity--c78cb6e5-0c4b-4611-8297-d1b8b55e40b5"
"course-of-action","course-of-action--54246e2e-683f-4bf2-be4c-d7d5a60e7d22","2018-10-17T00:14:20.652Z","2019-02-07T19:57:50.863Z","[{'url': 'https://attack.mitre.org/techniques/T1171', 'source_name': 'mitre-attack', 'external_id': 'T1171'}, {'url': 'https://adsecurity.org/?p=3299', 'source_name': 'ADSecurity Windows Secure Baseline', 'description': 'Metcalf, S. (2016, October 21). Securing Windows Workstations: Developing a Secure Baseline. Retrieved November 17, 2017.'}, {'url': 'https://byt3bl33d3r.github.io/practical-guide-to-ntlm-relaying-in-2017-aka-getting-a-foothold-in-under-5-minutes.html', 'source_name': 'byt3bl33d3r NTLM Relaying', 'description': 'Salvati, M. (2017, June 2). Practical guide to NTLM Relaying in 2017 (A.K.A getting a foothold in under 5 minutes). Retrieved February 7, 2019.'}, {'url': 'https://blog.secureideas.com/2018/04/ever-run-a-relay-why-smb-relays-should-be-on-your-mind.html', 'source_name': 'Secure Ideas SMB Relay', 'description': 'Kuehn, E. (2018, April 11). Ever Run a Relay? Why SMB Relays Should Be On Your Mind. Retrieved February 7, 2019.'}, {'url': 'https://docs.microsoft.com/en-us/previous-versions/system-center/operations-manager-2005/cc180803(v=technet.10)', 'source_name': 'Microsoft SMB Packet Signing', 'description': 'Microsoft. (2008, September 10). Using SMB Packet Signing. Retrieved February 7, 2019.'}]","['marking-definition--fa42a846-8d90-4e51-bc29-71d5b4802168']","LLMNR/NBT-NS Poisoning Mitigation","1.0","identity--c78cb6e5-0c4b-4611-8297-d1b8b55e40b5","Disable LLMNR and NetBIOS in local computer security settings or by group policy if they are not needed within an environment. (Citation: ADSecurity Windows Secure Baseline)

Use host-based security software to block LLMNR/NetBIOS traffic. Enabling SMB Signing can stop NTLMv2 relay attacks.(Citation: byt3bl33d3r NTLM Relaying)(Citation: Secure Ideas SMB Relay)(Citation: Microsoft SMB Packet Signing)","2.1","2.1.0","['enterprise-attack']","identity--c78cb6e5-0c4b-4611-8297-d1b8b55e40b5"
"course-of-action","course-of-action--7a6e5ca3-562f-4185-a323-f3b62b5b2e6b","2018-10-17T00:14:20.652Z","2018-10-17T00:14:20.652Z","[{'url': 'https://attack.mitre.org/techniques/T1177', 'source_name': 'mitre-attack', 'external_id': 'T1177'}, {'url': 'https://technet.microsoft.com/library/dn408187.aspx', 'source_name': 'Microsoft LSA Protection Mar 2014', 'description': 'Microsoft. (2014, March 12). Configuring Additional LSA Protection. Retrieved November 27, 2017.'}, {'url': 'https://docs.microsoft.com/windows/access-protection/credential-guard/credential-guard-manage', 'source_name': 'Microsoft Enable Cred Guard April 2017', 'description': 'Lich, B., Tobin, J., Hall, J. (2017, April 5). Manage Windows Defender Credential Guard. Retrieved November 27, 2017.'}, {'url': 'https://docs.microsoft.com/windows/access-protection/credential-guard/credential-guard-how-it-works', 'source_name': 'Microsoft Credential Guard April 2017', 'description': 'Lich, B., Tobin, J. (2017, April 5). How Windows Defender Credential Guard works. Retrieved November 27, 2017.'}, {'url': 'https://msdn.microsoft.com/library/windows/desktop/ff919712.aspx', 'source_name': 'Microsoft DLL Security', 'description': 'Microsoft. (n.d.). Dynamic-Link Library Security. Retrieved November 27, 2017.'}]","['marking-definition--fa42a846-8d90-4e51-bc29-71d5b4802168']","LSASS Driver Mitigation","1.0","identity--c78cb6e5-0c4b-4611-8297-d1b8b55e40b5","On Windows 8.1 and Server 2012 R2, enable LSA Protection by setting the Registry key `HKEY_LOCAL_MACHINE\SYSTEM\CurrentControlSet\Control\Lsa\RunAsPPL` to `dword:00000001`. (Citation: Microsoft LSA Protection Mar 2014) LSA Protection ensures that LSA plug-ins and drivers are only loaded if they are digitally signed with a Microsoft signature and adhere to the Microsoft Security Development Lifecycle (SDL) process guidance.

On Windows 10 and Server 2016, enable Windows Defender Credential Guard (Citation: Microsoft Enable Cred Guard April 2017) to run lsass.exe in an isolated virtualized environment without any device drivers. (Citation: Microsoft Credential Guard April 2017)

Ensure safe DLL search mode is enabled `HKEY_LOCAL_MACHINE\System\CurrentControlSet\Control\Session Manager\SafeDllSearchMode` to mitigate risk that lsass.exe loads a malicious code library. (Citation: Microsoft DLL Security)","2.1","2.1.0","['enterprise-attack']","identity--c78cb6e5-0c4b-4611-8297-d1b8b55e40b5"
"course-of-action","course-of-action--121b2863-5b97-4538-acb3-f8aae070ec13","2018-10-17T00:14:20.652Z","2018-10-17T00:14:20.652Z","[{'url': 'https://attack.mitre.org/techniques/T1159', 'source_name': 'mitre-attack', 'external_id': 'T1159'}]","['marking-definition--fa42a846-8d90-4e51-bc29-71d5b4802168']","Launch Agent Mitigation","1.0","identity--c78cb6e5-0c4b-4611-8297-d1b8b55e40b5","Restrict user's abilities to create Launch Agents with group policy.","2.1","2.1.0","['enterprise-attack']","identity--c78cb6e5-0c4b-4611-8297-d1b8b55e40b5"
"course-of-action","course-of-action--402e92cd-5608-4f4b-9a34-a2c962e4bcd7","2018-10-17T00:14:20.652Z","2018-10-17T00:14:20.652Z","[{'url': 'https://attack.mitre.org/techniques/T1160', 'source_name': 'mitre-attack', 'external_id': 'T1160'}]","['marking-definition--fa42a846-8d90-4e51-bc29-71d5b4802168']","Launch Daemon Mitigation","1.0","identity--c78cb6e5-0c4b-4611-8297-d1b8b55e40b5","Limit privileges of user accounts and remediate Privilege Escalation vectors so only authorized administrators can create new Launch Daemons.","2.1","2.1.0","['enterprise-attack']","identity--c78cb6e5-0c4b-4611-8297-d1b8b55e40b5"
"course-of-action","course-of-action--e333cf16-5bfa-453e-8e6a-3a4c63d6bfcc","2018-10-17T00:14:20.652Z","2018-10-17T00:14:20.652Z","[{'url': 'https://attack.mitre.org/techniques/T1152', 'source_name': 'mitre-attack', 'external_id': 'T1152'}]","['marking-definition--fa42a846-8d90-4e51-bc29-71d5b4802168']","Launchctl Mitigation","1.0","identity--c78cb6e5-0c4b-4611-8297-d1b8b55e40b5","Prevent users from installing their own launch agents or launch daemons and instead require them to be pushed out by group policy.","2.1","2.1.0","['enterprise-attack']","identity--c78cb6e5-0c4b-4611-8297-d1b8b55e40b5"
"course-of-action","course-of-action--c47a9b55-8f61-4b82-b833-1db6242c754e","2018-10-17T00:14:20.652Z","2018-10-17T00:14:20.652Z","[{'url': 'https://attack.mitre.org/techniques/T1168', 'source_name': 'mitre-attack', 'external_id': 'T1168'}]","['marking-definition--fa42a846-8d90-4e51-bc29-71d5b4802168']","Local Job Scheduling Mitigation","1.0","identity--c78cb6e5-0c4b-4611-8297-d1b8b55e40b5","Limit privileges of user accounts and remediate Privilege Escalation vectors so only authorized users can create scheduled jobs. Identify and block unnecessary system utilities or potentially malicious software that may be used to schedule jobs using whitelisting tools.","2.1","2.1.0","['enterprise-attack']","identity--c78cb6e5-0c4b-4611-8297-d1b8b55e40b5"
"course-of-action","course-of-action--06824aa2-94a5-474c-97f6-57c2e983d885","2018-10-17T00:14:20.652Z","2018-10-17T00:14:20.652Z","[{'url': 'https://attack.mitre.org/techniques/T1162', 'source_name': 'mitre-attack', 'external_id': 'T1162'}, {'url': 'https://support.apple.com/en-us/HT204005', 'source_name': 'Re-Open windows on Mac', 'description': 'Apple. (2016, December 6). Automatically re-open windows, apps, and documents on your Mac. Retrieved July 11, 2017.'}]","['marking-definition--fa42a846-8d90-4e51-bc29-71d5b4802168']","Login Item Mitigation","1.0","identity--c78cb6e5-0c4b-4611-8297-d1b8b55e40b5","Restrict users from being able to create their own login items. Additionally, holding the shift key during login prevents apps from opening automatically (Citation: Re-Open windows on Mac).","2.1","2.1.0","['enterprise-attack']","identity--c78cb6e5-0c4b-4611-8297-d1b8b55e40b5"
"course-of-action","course-of-action--9ab7de33-99b2-4d8d-8cf3-182fa0015cc2","2018-10-17T00:14:20.652Z","2018-10-17T00:14:20.652Z","[{'url': 'https://attack.mitre.org/techniques/T1037', 'source_name': 'mitre-attack', 'external_id': 'T1037'}, {'url': 'http://www.sans.org/reading-room/whitepapers/application/application-whitelisting-panacea-propaganda-33599', 'source_name': 'Beechey 2010', 'description': 'Beechey, J. (2010, December). Application Whitelisting: Panacea or Propaganda?. Retrieved November 18, 2014.'}, {'url': 'http://blog.jpcert.or.jp/2016/01/windows-commands-abused-by-attackers.html', 'source_name': 'Windows Commands JPCERT', 'description': 'Tomonaga, S. (2016, January 26). Windows Commands Abused by Attackers. Retrieved February 2, 2016.'}, {'url': 'https://www.iad.gov/iad/library/ia-guidance/tech-briefs/application-whitelisting-using-microsoft-applocker.cfm', 'source_name': 'NSA MS AppLocker', 'description': 'NSA Information Assurance Directorate. (2014, August). Application Whitelisting Using Microsoft AppLocker. Retrieved March 31, 2016.'}]","['marking-definition--fa42a846-8d90-4e51-bc29-71d5b4802168']","Logon Scripts Mitigation","1.0","identity--c78cb6e5-0c4b-4611-8297-d1b8b55e40b5","Restrict write access to logon scripts to specific administrators. Prevent access to administrator accounts by mitigating Credential Access techniques and limiting account access and permissions of [Valid Accounts](T1078).

Identify and block potentially malicious software that may be executed through logon script modification by using whitelisting (Citation: Beechey 2010) tools like AppLocker (Citation: Windows Commands JPCERT) (Citation: NSA MS AppLocker) that are capable of auditing and/or blocking unknown programs.","2.1","2.1.0","['enterprise-attack']","identity--c78cb6e5-0c4b-4611-8297-d1b8b55e40b5"
"course-of-action","course-of-action--94f6b4f5-b528-4f50-91d5-f66457c2f8f7","2018-10-17T00:14:20.652Z","2018-10-17T00:14:20.652Z","[{'url': 'https://attack.mitre.org/techniques/T1185', 'source_name': 'mitre-attack', 'external_id': 'T1185'}]","['marking-definition--fa42a846-8d90-4e51-bc29-71d5b4802168']","Man in the Browser Mitigation","1.0","identity--c78cb6e5-0c4b-4611-8297-d1b8b55e40b5","Since browser pivoting requires a high integrity process to launch from, restricting user permissions and addressing Privilege Escalation and [Bypass User Account Control](T1088) opportunities can limit the exposure to this technique. 

Close all browser sessions regularly and when they are no longer needed.","2.1","2.1.0","['enterprise-attack']","identity--c78cb6e5-0c4b-4611-8297-d1b8b55e40b5"
"course-of-action","course-of-action--45e7f570-6a0b-4095-bf02-4bca05da6bae","2018-10-17T00:14:20.652Z","2018-10-17T00:14:20.652Z","[{'url': 'https://attack.mitre.org/techniques/T1036', 'source_name': 'mitre-attack', 'external_id': 'T1036'}, {'url': 'http://www.sans.org/reading-room/whitepapers/application/application-whitelisting-panacea-propaganda-33599', 'source_name': 'Beechey 2010', 'description': 'Beechey, J. (2010, December). Application Whitelisting: Panacea or Propaganda?. Retrieved November 18, 2014.'}, {'url': 'http://blog.jpcert.or.jp/2016/01/windows-commands-abused-by-attackers.html', 'source_name': 'Windows Commands JPCERT', 'description': 'Tomonaga, S. (2016, January 26). Windows Commands Abused by Attackers. Retrieved February 2, 2016.'}, {'url': 'https://www.iad.gov/iad/library/ia-guidance/tech-briefs/application-whitelisting-using-microsoft-applocker.cfm', 'source_name': 'NSA MS AppLocker', 'description': 'NSA Information Assurance Directorate. (2014, August). Application Whitelisting Using Microsoft AppLocker. Retrieved March 31, 2016.'}, {'url': 'http://technet.microsoft.com/en-us/magazine/2008.06.srp.aspx', 'source_name': 'Corio 2008', 'description': 'Corio, C., & Sayana, D. P. (2008, June). Application Lockdown with Software Restriction Policies. Retrieved November 18, 2014.'}, {'url': 'https://technet.microsoft.com/en-us/library/ee791851.aspx', 'source_name': 'TechNet Applocker vs SRP', 'description': 'Microsoft. (2012, June 27). Using Software Restriction Policies and AppLocker Policies. Retrieved April 7, 2016.'}]","['marking-definition--fa42a846-8d90-4e51-bc29-71d5b4802168']","Masquerading Mitigation","1.0","identity--c78cb6e5-0c4b-4611-8297-d1b8b55e40b5","When creating security rules, avoid exclusions based on file name or file path. Require signed binaries. Use file system access controls to protect folders such as C:\Windows\System32. Use tools that restrict program execution via whitelisting by attributes other than file name.

Identify potentially malicious software that may look like a legitimate program based on name and location, and audit and/or block it by using whitelisting (Citation: Beechey 2010) tools like AppLocker (Citation: Windows Commands JPCERT) (Citation: NSA MS AppLocker) or Software Restriction Policies (Citation: Corio 2008) where appropriate. (Citation: TechNet Applocker vs SRP)","2.1","2.1.0","['enterprise-attack']","identity--c78cb6e5-0c4b-4611-8297-d1b8b55e40b5"
