"type","id","created","modified","external_references","object_marking_refs","name","x_mitre_version","created_by_ref","description","spec_version","x_mitre_attack_spec_version","x_mitre_domains","x_mitre_modified_by_ref"
"course-of-action","course-of-action--4f170666-7edb-4489-85c2-9affa28a72e0","2018-10-17T00:14:20.652Z","2018-10-17T00:14:20.652Z","[{'url': 'https://attack.mitre.org/techniques/T1156', 'source_name': 'mitre-attack', 'external_id': 'T1156'}]","['marking-definition--fa42a846-8d90-4e51-bc29-71d5b4802168']",".bash_profile and .bashrc Mitigation","1.0","identity--c78cb6e5-0c4b-4611-8297-d1b8b55e40b5","Making these files immutable and only changeable by certain administrators will limit the ability for adversaries to easily create user level persistence.","2.1","2.1.0","['enterprise-attack']","identity--c78cb6e5-0c4b-4611-8297-d1b8b55e40b5"
"course-of-action","course-of-action--c61fee9f-16fb-4f8c-bbf0-869093fcd4a6","2018-10-17T00:14:20.652Z","2018-10-17T00:14:20.652Z","[{'url': 'https://attack.mitre.org/techniques/T1134', 'source_name': 'mitre-attack', 'external_id': 'T1134'}, {'url': 'https://docs.microsoft.com/windows/device-security/security-policy-settings/create-a-token-object', 'source_name': 'Microsoft Create Token', 'description': 'Brower, N., Lich, B. (2017, April 19). Create a token object. Retrieved December 19, 2017.'}, {'url': 'https://docs.microsoft.com/windows/device-security/security-policy-settings/replace-a-process-level-token', 'source_name': 'Microsoft Replace Process Token', 'description': 'Brower, N., Lich, B. (2017, April 19). Replace a process level token. Retrieved December 19, 2017.'}]","['marking-definition--fa42a846-8d90-4e51-bc29-71d5b4802168']","Access Token Manipulation Mitigation","1.0","identity--c78cb6e5-0c4b-4611-8297-d1b8b55e40b5","Access tokens are an integral part of the security system within Windows and cannot be turned off. However, an attacker must already have administrator level access on the local system to make full use of this technique; be sure to restrict users and accounts to the least privileges they require to do their job.

Any user can also spoof access tokens if they have legitimate credentials. Follow mitigation guidelines for preventing adversary use of [Valid Accounts](T1078). Limit permissions so that users and user groups cannot create tokens. This setting should be defined for the local system account only. GPO: Computer Configuration > [Policies] > Windows Settings > Security Settings > Local Policies > User Rights Assignment: Create a token object. (Citation: Microsoft Create Token) Also define who can create a process level token to only the local and network service through GPO: Computer Configuration > [Policies] > Windows Settings > Security Settings > Local Policies > User Rights Assignment: Replace a process level token. (Citation: Microsoft Replace Process Token)

Also limit opportunities for adversaries to increase privileges by limiting Privilege Escalation opportunities.","2.1","2.1.0","['enterprise-attack']","identity--c78cb6e5-0c4b-4611-8297-d1b8b55e40b5"
"course-of-action","course-of-action--c085476e-1964-4d7f-86e1-d8657a7741e8","2018-10-17T00:14:20.652Z","2018-10-17T00:14:20.652Z","[{'url': 'https://attack.mitre.org/techniques/T1015', 'source_name': 'mitre-attack', 'external_id': 'T1015'}, {'url': 'https://technet.microsoft.com/en-us/library/cc732713.aspx', 'source_name': 'TechNet RDP NLA', 'description': 'Microsoft. (n.d.). Configure Network Level Authentication for Remote Desktop Services Connections. Retrieved June 6, 2016.'}, {'url': 'https://technet.microsoft.com/en-us/library/cc731150.aspx', 'source_name': 'TechNet RDP Gateway', 'description': 'Microsoft. (n.d.). Overview of Remote Desktop Gateway. Retrieved June 6, 2016.'}, {'url': 'http://www.sans.org/reading-room/whitepapers/application/application-whitelisting-panacea-propaganda-33599', 'source_name': 'Beechey 2010', 'description': 'Beechey, J. (2010, December). Application Whitelisting: Panacea or Propaganda?. Retrieved November 18, 2014.'}, {'url': 'http://blog.jpcert.or.jp/2016/01/windows-commands-abused-by-attackers.html', 'source_name': 'Windows Commands JPCERT', 'description': 'Tomonaga, S. (2016, January 26). Windows Commands Abused by Attackers. Retrieved February 2, 2016.'}, {'url': 'https://www.iad.gov/iad/library/ia-guidance/tech-briefs/application-whitelisting-using-microsoft-applocker.cfm', 'source_name': 'NSA MS AppLocker', 'description': 'NSA Information Assurance Directorate. (2014, August). Application Whitelisting Using Microsoft AppLocker. Retrieved March 31, 2016.'}, {'url': 'http://technet.microsoft.com/en-us/magazine/2008.06.srp.aspx', 'source_name': 'Corio 2008', 'description': 'Corio, C., & Sayana, D. P. (2008, June). Application Lockdown with Software Restriction Policies. Retrieved November 18, 2014.'}, {'url': 'https://technet.microsoft.com/en-us/library/ee791851.aspx', 'source_name': 'TechNet Applocker vs SRP', 'description': 'Microsoft. (2012, June 27). Using Software Restriction Policies and AppLocker Policies. Retrieved April 7, 2016.'}]","['marking-definition--fa42a846-8d90-4e51-bc29-71d5b4802168']","Accessibility Features Mitigation","1.0","identity--c78cb6e5-0c4b-4611-8297-d1b8b55e40b5","To use this technique remotely, an adversary must use it in conjunction with RDP. Ensure that Network Level Authentication is enabled to force the remote desktop session to authenticate before the session is created and the login screen displayed. It is enabled by default on Windows Vista and later. (Citation: TechNet RDP NLA)

If possible, use a Remote Desktop Gateway to manage connections and security configuration of RDP within a network. (Citation: TechNet RDP Gateway)

Identify and block potentially malicious software that may be executed by an adversary with this technique by using whitelisting (Citation: Beechey 2010) tools, like AppLocker, (Citation: Windows Commands JPCERT) (Citation: NSA MS AppLocker) or Software Restriction Policies (Citation: Corio 2008) where appropriate. (Citation: TechNet Applocker vs SRP)","2.1","2.1.0","['enterprise-attack']","identity--c78cb6e5-0c4b-4611-8297-d1b8b55e40b5"
"course-of-action","course-of-action--5c49bc54-9929-48ca-b581-7018219b5a97","2018-10-17T00:14:20.652Z","2018-10-17T00:14:20.652Z","[{'url': 'https://attack.mitre.org/techniques/T1087', 'source_name': 'mitre-attack', 'external_id': 'T1087'}, {'url': 'http://technet.microsoft.com/en-us/magazine/2008.06.srp.aspx', 'source_name': 'Corio 2008', 'description': 'Corio, C., & Sayana, D. P. (2008, June). Application Lockdown with Software Restriction Policies. Retrieved November 18, 2014.'}, {'url': 'http://www.sans.org/reading-room/whitepapers/application/application-whitelisting-panacea-propaganda-33599', 'source_name': 'Beechey 2010', 'description': 'Beechey, J. (2010, December). Application Whitelisting: Panacea or Propaganda?. Retrieved November 18, 2014.'}, {'url': 'http://blog.jpcert.or.jp/2016/01/windows-commands-abused-by-attackers.html', 'source_name': 'Windows Commands JPCERT', 'description': 'Tomonaga, S. (2016, January 26). Windows Commands Abused by Attackers. Retrieved February 2, 2016.'}, {'url': 'https://www.iad.gov/iad/library/ia-guidance/tech-briefs/application-whitelisting-using-microsoft-applocker.cfm', 'source_name': 'NSA MS AppLocker', 'description': 'NSA Information Assurance Directorate. (2014, August). Application Whitelisting Using Microsoft AppLocker. Retrieved March 31, 2016.'}, {'url': 'https://technet.microsoft.com/en-us/library/ee791851.aspx', 'source_name': 'TechNet Applocker vs SRP', 'description': 'Microsoft. (2012, June 27). Using Software Restriction Policies and AppLocker Policies. Retrieved April 7, 2016.'}, {'url': 'https://www.stigviewer.com/stig/microsoft_windows_server_2012_member_server/2013-07-25/finding/WN12-CC-000077', 'source_name': 'UCF STIG Elevation Account Enumeration', 'description': 'UCF. (n.d.). The system must require username and password to elevate a running application.. Retrieved December 18, 2017.'}]","['marking-definition--fa42a846-8d90-4e51-bc29-71d5b4802168']","Account Discovery Mitigation","1.0","identity--c78cb6e5-0c4b-4611-8297-d1b8b55e40b5","Prevent administrator accounts from being enumerated when an application is elevating through UAC since it can lead to the disclosure of account names. The Registry key is located `HKLM\ SOFTWARE\Microsoft\Windows\CurrentVersion\Policies\CredUI\EnumerateAdministrators`. It can be disabled through GPO: Computer Configuration > [Policies] > Administrative Templates > Windows Components > Credential User Interface: E numerate administrator accounts on elevation. (Citation: UCF STIG Elevation Account Enumeration)

Identify unnecessary system utilities or potentially malicious software that may be used to acquire information about system and domain accounts, and audit and/or block them by using whitelisting (Citation: Beechey 2010) tools, like AppLocker, (Citation: Windows Commands JPCERT) (Citation: NSA MS AppLocker) or Software Restriction Policies (Citation: Corio 2008) where appropriate. (Citation: TechNet Applocker vs SRP)","2.1","2.1.0","['enterprise-attack']","identity--c78cb6e5-0c4b-4611-8297-d1b8b55e40b5"
"course-of-action","course-of-action--fdb1ae84-7b00-4d3d-b7dc-c774beef6425","2018-10-17T00:14:20.652Z","2018-10-17T00:14:20.652Z","[{'url': 'https://attack.mitre.org/techniques/T1098', 'source_name': 'mitre-attack', 'external_id': 'T1098'}]","['marking-definition--fa42a846-8d90-4e51-bc29-71d5b4802168']","Account Manipulation Mitigation","1.0","identity--c78cb6e5-0c4b-4611-8297-d1b8b55e40b5","Use multifactor authentication. Follow guidelines to prevent or limit adversary access to [Valid Accounts](T1078).

Protect domain controllers by ensuring proper security configuration for critical servers. Configure access controls and firewalls to limit access to these systems. Do not allow domain administrator accounts to be used for day-to-day operations that may expose them to potential adversaries on unprivileged systems.","2.1","2.1.0","['enterprise-attack']","identity--c78cb6e5-0c4b-4611-8297-d1b8b55e40b5"
"course-of-action","course-of-action--95c29444-49f9-49f7-8b20-bcd68d8fcaa6","2018-10-17T00:14:20.652Z","2018-10-17T00:14:20.652Z","[{'url': 'https://attack.mitre.org/techniques/T1182', 'source_name': 'mitre-attack', 'external_id': 'T1182'}, {'url': 'http://www.sans.org/reading-room/whitepapers/application/application-whitelisting-panacea-propaganda-33599', 'source_name': 'Beechey 2010', 'description': 'Beechey, J. (2010, December). Application Whitelisting: Panacea or Propaganda?. Retrieved November 18, 2014.'}, {'url': 'http://blog.jpcert.or.jp/2016/01/windows-commands-abused-by-attackers.html', 'source_name': 'Windows Commands JPCERT', 'description': 'Tomonaga, S. (2016, January 26). Windows Commands Abused by Attackers. Retrieved February 2, 2016.'}, {'url': 'https://www.iad.gov/iad/library/ia-guidance/tech-briefs/application-whitelisting-using-microsoft-applocker.cfm', 'source_name': 'NSA MS AppLocker', 'description': 'NSA Information Assurance Directorate. (2014, August). Application Whitelisting Using Microsoft AppLocker. Retrieved March 31, 2016.'}]","['marking-definition--fa42a846-8d90-4e51-bc29-71d5b4802168']","AppCert DLLs Mitigation","1.0","identity--c78cb6e5-0c4b-4611-8297-d1b8b55e40b5","Identify and block potentially malicious software that may be executed through AppCert DLLs by using whitelisting (Citation: Beechey 2010) tools, like AppLocker, (Citation: Windows Commands JPCERT) (Citation: NSA MS AppLocker) that are capable of auditing and/or blocking unknown DLLs.","2.1","2.1.0","['enterprise-attack']","identity--c78cb6e5-0c4b-4611-8297-d1b8b55e40b5"
"course-of-action","course-of-action--10571bf2-8073-4edf-a71c-23bad225532e","2018-10-17T00:14:20.652Z","2018-10-17T00:14:20.652Z","[{'url': 'https://attack.mitre.org/techniques/T1103', 'source_name': 'mitre-attack', 'external_id': 'T1103'}, {'url': 'http://www.sans.org/reading-room/whitepapers/application/application-whitelisting-panacea-propaganda-33599', 'source_name': 'Beechey 2010', 'description': 'Beechey, J. (2010, December). Application Whitelisting: Panacea or Propaganda?. Retrieved November 18, 2014.'}, {'url': 'http://blog.jpcert.or.jp/2016/01/windows-commands-abused-by-attackers.html', 'source_name': 'Windows Commands JPCERT', 'description': 'Tomonaga, S. (2016, January 26). Windows Commands Abused by Attackers. Retrieved February 2, 2016.'}, {'url': 'https://www.iad.gov/iad/library/ia-guidance/tech-briefs/application-whitelisting-using-microsoft-applocker.cfm', 'source_name': 'NSA MS AppLocker', 'description': 'NSA Information Assurance Directorate. (2014, August). Application Whitelisting Using Microsoft AppLocker. Retrieved March 31, 2016.'}]","['marking-definition--fa42a846-8d90-4e51-bc29-71d5b4802168']","AppInit DLLs Mitigation","1.0","identity--c78cb6e5-0c4b-4611-8297-d1b8b55e40b5","Upgrade to Windows 8 or later and enable secure boot.

Identify and block potentially malicious software that may be executed through AppInit DLLs by using whitelisting (Citation: Beechey 2010) tools, like AppLocker, (Citation: Windows Commands JPCERT) (Citation: NSA MS AppLocker) that are capable of auditing and/or blocking unknown DLLs.","2.1","2.1.0","['enterprise-attack']","identity--c78cb6e5-0c4b-4611-8297-d1b8b55e40b5"
"course-of-action","course-of-action--1e4ef2c7-ee96-4484-9baa-3b5777561301","2018-10-17T00:14:20.652Z","2018-10-17T00:14:20.652Z","[{'url': 'https://attack.mitre.org/techniques/T1155', 'source_name': 'mitre-attack', 'external_id': 'T1155'}, {'url': 'https://www.engadget.com/2013/10/23/applescript-and-automator-gain-new-features-in-os-x-mavericks/', 'source_name': 'applescript signing', 'description': 'Steven Sande. (2013, December 23). AppleScript and Automator gain new features in OS X Mavericks. Retrieved September 21, 2018.'}]","['marking-definition--fa42a846-8d90-4e51-bc29-71d5b4802168']","AppleScript Mitigation","1.0","identity--c78cb6e5-0c4b-4611-8297-d1b8b55e40b5","Require that all AppleScript be signed by a trusted developer ID before being executed - this will prevent random AppleScript code from executing  (Citation: applescript signing). This subjects AppleScript code to the same scrutiny as other .app files passing through Gatekeeper.","2.1","2.1.0","['enterprise-attack']","identity--c78cb6e5-0c4b-4611-8297-d1b8b55e40b5"
"course-of-action","course-of-action--c88151a5-fe3f-4773-8147-d801587065a4","2018-10-17T00:14:20.652Z","2018-04-30T13:45:13.024Z","[{'url': 'https://attack.mitre.org/techniques/T1017', 'source_name': 'mitre-attack', 'external_id': 'T1017'}]","['marking-definition--fa42a846-8d90-4e51-bc29-71d5b4802168']","Application Deployment Software Mitigation","1.0","identity--c78cb6e5-0c4b-4611-8297-d1b8b55e40b5","Grant access to application deployment systems only to a limited number of authorized administrators. Ensure proper system and access isolation for critical network systems through use of firewalls, account privilege separation, group policy, and multifactor authentication. Verify that account credentials that may be used to access deployment systems are unique and not used throughout the enterprise network. Patch deployment systems regularly to prevent potential remote access through [Exploitation for Privilege Escalation](T1068). 

If the application deployment system can be configured to deploy only signed binaries, then ensure that the trusted signing certificates are not co-located with the application deployment system and are instead located on a system that cannot be accessed remotely or to which remote access is tightly controlled.","2.1","2.1.0","['enterprise-attack']","identity--c78cb6e5-0c4b-4611-8297-d1b8b55e40b5"
"course-of-action","course-of-action--cfc2d2fc-14ff-495f-bd99-585be47b804f","2018-10-17T00:14:20.652Z","2018-10-17T00:14:20.652Z","[{'url': 'https://attack.mitre.org/techniques/T1138', 'source_name': 'mitre-attack', 'external_id': 'T1138'}]","['marking-definition--fa42a846-8d90-4e51-bc29-71d5b4802168']","Application Shimming Mitigation","1.0","identity--c78cb6e5-0c4b-4611-8297-d1b8b55e40b5","There currently aren't a lot of ways to mitigate application shimming. Disabling the Shim Engine isn't recommended because Windows depends on shimming for interoperability and software may become unstable or not work. Microsoft released an optional patch update - KB3045645 - that will remove the ""auto-elevate"" flag within the sdbinst.exe. This will prevent use of application shimming to bypass UAC. 

Changing UAC settings to ""Always Notify"" will give the user more visibility when UAC elevation is requested, however, this option will not be popular among users due to the constant UAC interruptions.","2.1","2.1.0","['enterprise-attack']","identity--c78cb6e5-0c4b-4611-8297-d1b8b55e40b5"
"course-of-action","course-of-action--25d5e1d8-c6fb-4735-bc57-115a21222f4b","2018-10-17T00:14:20.652Z","2018-10-17T00:14:20.652Z","[{'url': 'https://attack.mitre.org/techniques/T1010', 'source_name': 'mitre-attack', 'external_id': 'T1010'}, {'url': 'http://www.sans.org/reading-room/whitepapers/application/application-whitelisting-panacea-propaganda-33599', 'source_name': 'Beechey 2010', 'description': 'Beechey, J. (2010, December). Application Whitelisting: Panacea or Propaganda?. Retrieved November 18, 2014.'}, {'url': 'http://blog.jpcert.or.jp/2016/01/windows-commands-abused-by-attackers.html', 'source_name': 'Windows Commands JPCERT', 'description': 'Tomonaga, S. (2016, January 26). Windows Commands Abused by Attackers. Retrieved February 2, 2016.'}, {'url': 'https://www.iad.gov/iad/library/ia-guidance/tech-briefs/application-whitelisting-using-microsoft-applocker.cfm', 'source_name': 'NSA MS AppLocker', 'description': 'NSA Information Assurance Directorate. (2014, August). Application Whitelisting Using Microsoft AppLocker. Retrieved March 31, 2016.'}, {'url': 'http://technet.microsoft.com/en-us/magazine/2008.06.srp.aspx', 'source_name': 'Corio 2008', 'description': 'Corio, C., & Sayana, D. P. (2008, June). Application Lockdown with Software Restriction Policies. Retrieved November 18, 2014.'}, {'url': 'https://technet.microsoft.com/en-us/library/ee791851.aspx', 'source_name': 'TechNet Applocker vs SRP', 'description': 'Microsoft. (2012, June 27). Using Software Restriction Policies and AppLocker Policies. Retrieved April 7, 2016.'}]","['marking-definition--fa42a846-8d90-4e51-bc29-71d5b4802168']","Application Window Discovery Mitigation","1.0","identity--c78cb6e5-0c4b-4611-8297-d1b8b55e40b5","Identify unnecessary system utilities or potentially malicious software that may be used to acquire information, and audit and/or block them by using whitelisting (Citation: Beechey 2010) tools, like AppLocker, (Citation: Windows Commands JPCERT) (Citation: NSA MS AppLocker) or Software Restriction Policies (Citation: Corio 2008) where appropriate. (Citation: TechNet Applocker vs SRP)","2.1","2.1.0","['enterprise-attack']","identity--c78cb6e5-0c4b-4611-8297-d1b8b55e40b5"
"course-of-action","course-of-action--16dd03c6-0dfb-4d77-89cd-9ff3ee6e533d","2018-10-17T00:14:20.652Z","2018-10-17T00:14:20.652Z","[{'url': 'https://attack.mitre.org/techniques/T1123', 'source_name': 'mitre-attack', 'external_id': 'T1123'}, {'url': 'http://www.sans.org/reading-room/whitepapers/application/application-whitelisting-panacea-propaganda-33599', 'source_name': 'Beechey 2010', 'description': 'Beechey, J. (2010, December). Application Whitelisting: Panacea or Propaganda?. Retrieved November 18, 2014.'}, {'url': 'http://blog.jpcert.or.jp/2016/01/windows-commands-abused-by-attackers.html', 'source_name': 'Windows Commands JPCERT', 'description': 'Tomonaga, S. (2016, January 26). Windows Commands Abused by Attackers. Retrieved February 2, 2016.'}, {'url': 'https://www.iad.gov/iad/library/ia-guidance/tech-briefs/application-whitelisting-using-microsoft-applocker.cfm', 'source_name': 'NSA MS AppLocker', 'description': 'NSA Information Assurance Directorate. (2014, August). Application Whitelisting Using Microsoft AppLocker. Retrieved March 31, 2016.'}, {'url': 'http://technet.microsoft.com/en-us/magazine/2008.06.srp.aspx', 'source_name': 'Corio 2008', 'description': 'Corio, C., & Sayana, D. P. (2008, June). Application Lockdown with Software Restriction Policies. Retrieved November 18, 2014.'}, {'url': 'https://technet.microsoft.com/en-us/library/ee791851.aspx', 'source_name': 'TechNet Applocker vs SRP', 'description': 'Microsoft. (2012, June 27). Using Software Restriction Policies and AppLocker Policies. Retrieved April 7, 2016.'}]","['marking-definition--fa42a846-8d90-4e51-bc29-71d5b4802168']","Audio Capture Mitigation","1.0","identity--c78cb6e5-0c4b-4611-8297-d1b8b55e40b5","Mitigating this technique specifically may be difficult as it requires fine-grained API control. Efforts should be focused on preventing unwanted or unknown code from executing on a system.

Identify and block potentially malicious software that may be used to record audio by using whitelisting (Citation: Beechey 2010) tools, like AppLocker, (Citation: Windows Commands JPCERT) (Citation: NSA MS AppLocker) or Software Restriction Policies (Citation: Corio 2008) where appropriate. (Citation: TechNet Applocker vs SRP)","2.1","2.1.0","['enterprise-attack']","identity--c78cb6e5-0c4b-4611-8297-d1b8b55e40b5"
"course-of-action","course-of-action--943d370b-2054-44df-8be2-ab4139bde1c5","2018-10-17T00:14:20.652Z","2018-10-17T00:14:20.652Z","[{'url': 'https://attack.mitre.org/techniques/T1131', 'source_name': 'mitre-attack', 'external_id': 'T1131'}, {'url': 'http://docplayer.net/20839173-Analysis-of-malicious-security-support-provider-dlls.html', 'source_name': 'Graeber 2014', 'description': 'Graeber, M. (2014, October). Analysis of Malicious Security Support Provider DLLs. Retrieved March 1, 2017.'}, {'url': 'https://technet.microsoft.com/en-us/library/dn408187.aspx', 'source_name': 'Microsoft Configure LSA', 'description': 'Microsoft. (2013, July 31). Configuring Additional LSA Protection. Retrieved June 24, 2015.'}]","['marking-definition--fa42a846-8d90-4e51-bc29-71d5b4802168']","Authentication Package Mitigation","1.0","identity--c78cb6e5-0c4b-4611-8297-d1b8b55e40b5","Windows 8.1, Windows Server 2012 R2, and later versions, may make LSA run as a Protected Process Light (PPL) by setting the Registry key `HKLM\SYSTEM\CurrentControlSet\Control\Lsa\RunAsPPL`, which requires all DLLs loaded by LSA to be signed by Microsoft. (Citation: Graeber 2014) (Citation: Microsoft Configure LSA)","2.1","2.1.0","['enterprise-attack']","identity--c78cb6e5-0c4b-4611-8297-d1b8b55e40b5"
"course-of-action","course-of-action--8bd1ae32-a686-48f4-a6f8-470287f76152","2018-10-17T00:14:20.652Z","2018-10-17T00:14:20.652Z","[{'url': 'https://attack.mitre.org/techniques/T1119', 'source_name': 'mitre-attack', 'external_id': 'T1119'}, {'url': 'http://www.sans.org/reading-room/whitepapers/application/application-whitelisting-panacea-propaganda-33599', 'source_name': 'Beechey 2010', 'description': 'Beechey, J. (2010, December). Application Whitelisting: Panacea or Propaganda?. Retrieved November 18, 2014.'}, {'url': 'http://blog.jpcert.or.jp/2016/01/windows-commands-abused-by-attackers.html', 'source_name': 'Windows Commands JPCERT', 'description': 'Tomonaga, S. (2016, January 26). Windows Commands Abused by Attackers. Retrieved February 2, 2016.'}, {'url': 'https://www.iad.gov/iad/library/ia-guidance/tech-briefs/application-whitelisting-using-microsoft-applocker.cfm', 'source_name': 'NSA MS AppLocker', 'description': 'NSA Information Assurance Directorate. (2014, August). Application Whitelisting Using Microsoft AppLocker. Retrieved March 31, 2016.'}, {'url': 'http://technet.microsoft.com/en-us/magazine/2008.06.srp.aspx', 'source_name': 'Corio 2008', 'description': 'Corio, C., & Sayana, D. P. (2008, June). Application Lockdown with Software Restriction Policies. Retrieved November 18, 2014.'}, {'url': 'https://technet.microsoft.com/en-us/library/ee791851.aspx', 'source_name': 'TechNet Applocker vs SRP', 'description': 'Microsoft. (2012, June 27). Using Software Restriction Policies and AppLocker Policies. Retrieved April 7, 2016.'}]","['marking-definition--fa42a846-8d90-4e51-bc29-71d5b4802168']","Automated Collection Mitigation","1.0","identity--c78cb6e5-0c4b-4611-8297-d1b8b55e40b5","Encryption and off-system storage of sensitive information may be one way to mitigate collection of files, but may not stop an adversary from acquiring the information if an intrusion persists over a long period of time and the adversary is able to discover and access the data through other means. A keylogger installed on a system may be able to intercept passwords through [Input Capture](T1056) and be used to decrypt protected documents that an adversary may have collected. Strong passwords should be used to prevent offline cracking of encrypted documents through [Brute Force](T1110) techniques.

Identify unnecessary system utilities, third-party tools, or potentially malicious software that may be used to collect files and audit and/or block them by using whitelisting (Citation: Beechey 2010) tools, like AppLocker, (Citation: Windows Commands JPCERT) (Citation: NSA MS AppLocker) or Software Restriction Policies (Citation: Corio 2008) where appropriate. (Citation: TechNet Applocker vs SRP)","2.1","2.1.0","['enterprise-attack']","identity--c78cb6e5-0c4b-4611-8297-d1b8b55e40b5"
