"type","id","created","modified","name","description","external_references","created_by_ref","spec_version","x_mitre_attack_spec_version","x_mitre_domains","x_mitre_modified_by_ref","x_mitre_version"
"course-of-action","course-of-action--7a4d0054-53cd-476f-88af-955dddc80ee0","2018-04-18T17:59:24.739Z","2018-04-18T17:59:24.739Z","Drive-by Compromise Mitigation","Drive-by compromise relies on there being a vulnerable piece of software on the client end systems. Use modern browsers with security features turned on. Ensure all browsers and plugins kept updated can help prevent the exploit phase of this technique.

For malicious code served up through ads, adblockers can help prevent that code from executing in the first place. Script blocking extensions can help prevent the execution of JavaScript that may commonly be used during the exploitation process.

Browser sandboxes can be used to mitigate some of the impact of exploitation, but sandbox escapes may still exist. (Citation: Windows Blogs Microsoft Edge Sandbox) (Citation: Ars Technica Pwn2Own 2017 VM Escape)

Other types of virtualization and application microsegmentation may also mitigate the impact of client-side exploitation. The risks of additional exploits and weaknesses in implementation may still exist. (Citation: Ars Technica Pwn2Own 2017 VM Escape)

Security applications that look for behavior used during exploitation such as Windows Defender Exploit Guard (WDEG) and the Enhanced Mitigation Experience Toolkit (EMET) can be used to mitigate some exploitation behavior. (Citation: TechNet Moving Beyond EMET) Control flow integrity checking is another way to potentially identify and stop a software exploit from occurring. (Citation: Wikipedia Control Flow Integrity) Many of these protections depend on the architecture and target application binary for compatibility.","[{'url': 'https://attack.mitre.org/wiki/Technique/T1189', 'source_name': 'mitre-attack', 'external_id': 'T1189'}, {'description': 'Cowan, C. (2017, March 23). Strengthening the Microsoft Edge Sandbox. Retrieved March 12, 2018.', 'source_name': 'Windows Blogs Microsoft Edge Sandbox', 'url': 'https://blogs.windows.com/msedgedev/2017/03/23/strengthening-microsoft-edge-sandbox/'}, {'description': 'Goodin, D. (2017, March 17). Virtual machine escape fetches $105,000 at Pwn2Own hacking contest - updated. Retrieved March 12, 2018.', 'source_name': 'Ars Technica Pwn2Own 2017 VM Escape', 'url': 'https://arstechnica.com/information-technology/2017/03/hack-that-escapes-vm-by-exploiting-edge-browser-fetches-105000-at-pwn2own/'}, {'description': 'Nunez, N. (2017, August 9). Moving Beyond EMET II – Windows Defender Exploit Guard. Retrieved March 12, 2018.', 'source_name': 'TechNet Moving Beyond EMET', 'url': 'https://blogs.technet.microsoft.com/srd/2017/08/09/moving-beyond-emet-ii-windows-defender-exploit-guard/'}, {'description': 'Wikipedia. (2018, January 11). Control-flow integrity. Retrieved March 12, 2018.', 'source_name': 'Wikipedia Control Flow Integrity', 'url': 'https://en.wikipedia.org/wiki/Control-flow%20integrity'}]","identity--c78cb6e5-0c4b-4611-8297-d1b8b55e40b5","2.1","2.1.0","['enterprise-attack']","identity--c78cb6e5-0c4b-4611-8297-d1b8b55e40b5","1.0"
"course-of-action","course-of-action--dc43c2fe-355e-4a79-9570-3267b0992784","2018-04-18T17:59:24.739Z","2018-04-18T17:59:24.739Z","Dylib Hijacking Mitigation","Prevent users from being able to write files to the search paths for applications, both in the folders where applications are run from and the standard dylib folders. If users can't write to these directories, then they can't intercept the search path.","[{'url': 'https://attack.mitre.org/wiki/Technique/T1157', 'source_name': 'mitre-attack', 'external_id': 'T1157'}]","identity--c78cb6e5-0c4b-4611-8297-d1b8b55e40b5","2.1","2.1.0","['enterprise-attack']","identity--c78cb6e5-0c4b-4611-8297-d1b8b55e40b5","1.0"
"course-of-action","course-of-action--80c91478-ac87-434f-bee7-11f37aec4d74","2018-04-18T17:59:24.739Z","2018-04-18T17:59:24.739Z","Dynamic Data Exchange Mitigation","Registry keys specific to Microsoft Office feature control security can be set to disable automatic DDE/OLE execution. (Citation: Microsoft DDE Advisory Nov 2017) (Citation: BleepingComputer DDE Disabled in Word Dec 2017) (Citation: GitHub Disable DDEAUTO Oct 2017) Microsoft also created Registry keys to completely disable DDE execution in Word and Excel. (Citation: Microsoft ADV170021 Dec 2017)

Ensure Protected View is enabled (Citation: Microsoft Protected View) and consider disabling embedded files in Office programs, such as OneNote, not enrolled in Protected View. (Citation: Enigma Reviving DDE Jan 2018) (Citation: GitHub Disable DDEAUTO Oct 2017)

On Windows 10, enable Attack Surface Reduction (ASR) rules to prevent DDE attacks and spawning of child processes from Office programs. (Citation: Microsoft ASR Nov 2017) (Citation: Enigma Reviving DDE Jan 2018)","[{'url': 'https://attack.mitre.org/wiki/Technique/T1173', 'source_name': 'mitre-attack', 'external_id': 'T1173'}, {'description': 'Cimpanu, C. (2017, December 15). Microsoft Disables DDE Feature in Word to Prevent Further Malware Attacks. Retrieved December 19, 2017.', 'source_name': 'BleepingComputer DDE Disabled in Word Dec 2017', 'url': 'https://www.bleepingcomputer.com/news/microsoft/microsoft-disables-dde-feature-in-word-to-prevent-further-malware-attacks/'}, {'description': 'Microsoft. (n.d.). What is Protected View?. Retrieved November 22, 2017.', 'source_name': 'Microsoft Protected View', 'url': 'https://support.office.com/en-us/article/What-is-Protected-View-d6f09ac7-e6b9-4495-8e43-2bbcdbcb6653'}, {'description': 'Microsoft. (2017, November 8). Microsoft Security Advisory 4053440 - Securely opening Microsoft Office documents that contain Dynamic Data Exchange (DDE) fields. Retrieved November 21, 2017.', 'source_name': 'Microsoft DDE Advisory Nov 2017', 'url': 'https://technet.microsoft.com/library/security/4053440'}, {'description': 'Microsoft. (2017, December 12). ADV170021 - Microsoft Office Defense in Depth Update. Retrieved February 3, 2018.', 'source_name': 'Microsoft ADV170021 Dec 2017', 'url': 'https://portal.msrc.microsoft.com/security-guidance/advisory/ADV170021'}, {'description': 'Nelson, M. (2018, January 29). Reviving DDE: Using OneNote and Excel for Code Execution. Retrieved February 3, 2018.', 'source_name': 'Enigma Reviving DDE Jan 2018', 'url': 'https://posts.specterops.io/reviving-dde-using-onenote-and-excel-for-code-execution-d7226864caee'}, {'description': 'Dormann, W. (2017, October 20). Disable DDEAUTO for Outlook, Word, OneNote, and Excel versions 2010, 2013, 2016. Retrieved February 3, 2018.', 'source_name': 'GitHub Disable DDEAUTO Oct 2017', 'url': 'https://gist.github.com/wdormann/732bb88d9b5dd5a66c9f1e1498f31a1b'}, {'description': ""Brower, N. & D'Souza-Wiltshire, I. (2017, November 9). Enable Attack surface reduction. Retrieved February 3, 2018."", 'source_name': 'Microsoft ASR Nov 2017', 'url': 'https://docs.microsoft.com/windows/threat-protection/windows-defender-exploit-guard/enable-attack-surface-reduction'}]","identity--c78cb6e5-0c4b-4611-8297-d1b8b55e40b5","2.1","2.1.0","['enterprise-attack']","identity--c78cb6e5-0c4b-4611-8297-d1b8b55e40b5","1.0"
"course-of-action","course-of-action--383caaa3-c46a-4f61-b2e3-653eb132f0e7","2018-04-18T17:59:24.739Z","2018-04-18T17:59:24.739Z","Email Collection Mitigation","Use of encryption provides an added layer of security to sensitive information sent over email. Encryption using public key cryptography requires the adversary to obtain the private certificate along with an encryption key to decrypt messages.

Use of two-factor authentication for public-facing webmail servers is also a recommended best practice to minimize the usefulness of user names and passwords to adversaries.

Identify unnecessary system utilities or potentially malicious software that may be used to collect email data files or access the corporate email server, and audit and/or block them by using whitelisting (Citation: Beechey 2010) tools, like AppLocker, (Citation: Windows Commands JPCERT) (Citation: NSA MS AppLocker) or Software Restriction Policies (Citation: Corio 2008) where appropriate. (Citation: TechNet Applocker vs SRP)","[{'url': 'https://attack.mitre.org/wiki/Technique/T1114', 'source_name': 'mitre-attack', 'external_id': 'T1114'}, {'description': 'Beechey, J. (2010, December). Application Whitelisting: Panacea or Propaganda?. Retrieved November 18, 2014.', 'source_name': 'Beechey 2010', 'url': 'http://www.sans.org/reading-room/whitepapers/application/application-whitelisting-panacea-propaganda-33599'}, {'description': 'Tomonaga, S. (2016, January 26). Windows Commands Abused by Attackers. Retrieved February 2, 2016.', 'source_name': 'Windows Commands JPCERT', 'url': 'http://blog.jpcert.or.jp/2016/01/windows-commands-abused-by-attackers.html'}, {'description': 'NSA Information Assurance Directorate. (2014, August). Application Whitelisting Using Microsoft AppLocker. Retrieved March 31, 2016.', 'source_name': 'NSA MS AppLocker', 'url': 'https://www.iad.gov/iad/library/ia-guidance/tech-briefs/application-whitelisting-using-microsoft-applocker.cfm'}, {'description': 'Corio, C., & Sayana, D. P. (2008, June). Application Lockdown with Software Restriction Policies. Retrieved November 18, 2014.', 'source_name': 'Corio 2008', 'url': 'http://technet.microsoft.com/en-us/magazine/2008.06.srp.aspx'}, {'description': 'Microsoft. (2012, June 27). Using Software Restriction Policies and AppLocker Policies. Retrieved April 7, 2016.', 'source_name': 'TechNet Applocker vs SRP', 'url': 'https://technet.microsoft.com/en-us/library/ee791851.aspx'}]","identity--c78cb6e5-0c4b-4611-8297-d1b8b55e40b5","2.1","2.1.0","['enterprise-attack']","identity--c78cb6e5-0c4b-4611-8297-d1b8b55e40b5","1.0"
"course-of-action","course-of-action--56db6ccc-433d-4411-8383-c3fd7053e2c8","2018-04-18T17:59:24.739Z","2018-04-18T17:59:24.739Z","Execution through API Mitigation","Mitigating specific API calls will likely have unintended side effects, such as preventing legitimate software from operating properly. Efforts should be focused on preventing adversary tools from running earlier in the chain of activity and on identifying subsequent malicious behavior. Audit and/or block potentially malicious software by using whitelisting (Citation: Beechey 2010) tools, like AppLocker, (Citation: Windows Commands JPCERT) (Citation: NSA MS AppLocker) or Software Restriction Policies (Citation: Corio 2008) where appropriate. (Citation: TechNet Applocker vs SRP)","[{'url': 'https://attack.mitre.org/wiki/Technique/T1106', 'source_name': 'mitre-attack', 'external_id': 'T1106'}, {'description': 'Beechey, J. (2010, December). Application Whitelisting: Panacea or Propaganda?. Retrieved November 18, 2014.', 'source_name': 'Beechey 2010', 'url': 'http://www.sans.org/reading-room/whitepapers/application/application-whitelisting-panacea-propaganda-33599'}, {'description': 'Tomonaga, S. (2016, January 26). Windows Commands Abused by Attackers. Retrieved February 2, 2016.', 'source_name': 'Windows Commands JPCERT', 'url': 'http://blog.jpcert.or.jp/2016/01/windows-commands-abused-by-attackers.html'}, {'description': 'NSA Information Assurance Directorate. (2014, August). Application Whitelisting Using Microsoft AppLocker. Retrieved March 31, 2016.', 'source_name': 'NSA MS AppLocker', 'url': 'https://www.iad.gov/iad/library/ia-guidance/tech-briefs/application-whitelisting-using-microsoft-applocker.cfm'}, {'description': 'Corio, C., & Sayana, D. P. (2008, June). Application Lockdown with Software Restriction Policies. Retrieved November 18, 2014.', 'source_name': 'Corio 2008', 'url': 'http://technet.microsoft.com/en-us/magazine/2008.06.srp.aspx'}, {'description': 'Microsoft. (2012, June 27). Using Software Restriction Policies and AppLocker Policies. Retrieved April 7, 2016.', 'source_name': 'TechNet Applocker vs SRP', 'url': 'https://technet.microsoft.com/en-us/library/ee791851.aspx'}]","identity--c78cb6e5-0c4b-4611-8297-d1b8b55e40b5","2.1","2.1.0","['enterprise-attack']","identity--c78cb6e5-0c4b-4611-8297-d1b8b55e40b5","1.0"
"course-of-action","course-of-action--cfd2cd3b-93e7-4b3e-ab46-f8bcafdbdfcf","2018-04-18T17:59:24.739Z","2018-04-18T17:59:24.739Z","Execution through Module Load Mitigation","Directly mitigating module loads and API calls related to module loads will likely have unintended side effects, such as preventing legitimate software from operating properly. Efforts should be focused on preventing adversary tools from running earlier in the chain of activity and on identifying and correlated subsequent behavior to determine if it is the result of malicious activity.","[{'url': 'https://attack.mitre.org/wiki/Technique/T1129', 'source_name': 'mitre-attack', 'external_id': 'T1129'}]","identity--c78cb6e5-0c4b-4611-8297-d1b8b55e40b5","2.1","2.1.0","['enterprise-attack']","identity--c78cb6e5-0c4b-4611-8297-d1b8b55e40b5","1.0"
"course-of-action","course-of-action--0e5bdf42-a7f7-4d16-a074-4915bd262f80","2018-04-18T17:59:24.739Z","2018-04-18T17:59:24.739Z","Exfiltration Over Alternative Protocol Mitigation","Follow best practices for network firewall configurations to allow only necessary ports and traffic to enter and exit the network. For example, if services like FTP are not required for sending information outside of a network, then block FTP-related ports at the network perimeter. Enforce proxies and use dedicated servers for services such as DNS and only allow those systems to communicate over respective ports/protocols, instead of all systems within a network. (Citation: TechNet Firewall Design) These actions will help reduce command and control and exfiltration path opportunities.

Network intrusion detection and prevention systems that use network signatures to identify traffic for specific adversary command and control infrastructure and malware can be used to mitigate activity at the network level. Signatures are often for unique indicators within protocols and may be based on the specific obfuscation technique used by a particular adversary or tool, and will likely be different across various malware families and versions. Adversaries will likely change tool command and control signatures over time or construct protocols in such a way to avoid detection by common defensive tools. (Citation: University of Birmingham C2)","[{'url': 'https://attack.mitre.org/wiki/Technique/T1048', 'source_name': 'mitre-attack', 'external_id': 'T1048'}, {'description': 'Microsoft. (2004, February 6). Perimeter Firewall Design. Retrieved April 25, 2016.', 'source_name': 'TechNet Firewall Design', 'url': 'https://technet.microsoft.com/en-us/library/cc700828.aspx'}, {'description': 'Gardiner, J.,  Cova, M., Nagaraja, S. (2014, February). Command & Control Understanding, Denying and Detecting. Retrieved April 20, 2016.', 'source_name': 'University of Birmingham C2', 'url': 'https://arxiv.org/ftp/arxiv/papers/1408/1408.1136.pdf'}]","identity--c78cb6e5-0c4b-4611-8297-d1b8b55e40b5","2.1","2.1.0","['enterprise-attack']","identity--c78cb6e5-0c4b-4611-8297-d1b8b55e40b5","1.0"
"course-of-action","course-of-action--92c28497-2820-445e-9f3e-a03dd77dc0c8","2018-04-18T17:59:24.739Z","2018-04-18T17:59:24.739Z","Exfiltration Over Command and Control Channel Mitigation","Mitigations for command and control apply. Network intrusion detection and prevention systems that use network signatures to identify traffic for specific adversary malware can be used to mitigate activity at the network level. Signatures are often for unique indicators within protocols and may be based on the specific obfuscation technique used by a particular adversary or tool, and will likely be different across various malware families and versions. Adversaries will likely change tool command and control signatures over time or construct protocols in such a way to avoid detection by common defensive tools. (Citation: University of Birmingham C2)","[{'url': 'https://attack.mitre.org/wiki/Technique/T1041', 'source_name': 'mitre-attack', 'external_id': 'T1041'}, {'description': 'Gardiner, J.,  Cova, M., Nagaraja, S. (2014, February). Command & Control Understanding, Denying and Detecting. Retrieved April 20, 2016.', 'source_name': 'University of Birmingham C2', 'url': 'https://arxiv.org/ftp/arxiv/papers/1408/1408.1136.pdf'}]","identity--c78cb6e5-0c4b-4611-8297-d1b8b55e40b5","2.1","2.1.0","['enterprise-attack']","identity--c78cb6e5-0c4b-4611-8297-d1b8b55e40b5","1.0"
"course-of-action","course-of-action--e547ed6a-f1ca-40df-8613-2ce27927f145","2018-04-18T17:59:24.739Z","2018-04-18T17:59:24.739Z","Exfiltration Over Physical Medium Mitigation","Disable Autorun if it is unnecessary. (Citation: Microsoft Disable Autorun) Disallow or restrict removable media at an organizational policy level if they are not required for business operations. (Citation: TechNet Removable Media Control)","[{'url': 'https://attack.mitre.org/wiki/Technique/T1052', 'source_name': 'mitre-attack', 'external_id': 'T1052'}, {'description': 'Microsoft. (n.d.). How to disable the Autorun functionality in Windows. Retrieved April 20, 2016.', 'source_name': 'Microsoft Disable Autorun', 'url': 'https://support.microsoft.com/en-us/kb/967715'}, {'description': 'Microsoft. (2007, August 31). https://technet.microsoft.com/en-us/library/cc771759(v=ws.10).aspx. Retrieved April 20, 2016.', 'source_name': 'TechNet Removable Media Control', 'url': 'https://technet.microsoft.com/en-us/library/cc772540(v=ws.10).aspx'}]","identity--c78cb6e5-0c4b-4611-8297-d1b8b55e40b5","2.1","2.1.0","['enterprise-attack']","identity--c78cb6e5-0c4b-4611-8297-d1b8b55e40b5","1.0"
"course-of-action","course-of-action--65da1eb6-d35d-4853-b280-98a76c0aef53","2018-04-18T17:59:24.739Z","2018-04-18T17:59:24.739Z","Exploit Public-Facing Application Mitigation","Application Isolation and least privilege help lesson the impact of an exploit. Application isolation will limit what other processes and system features the exploited target can access, and least privilege for service accounts will limit what permissions the exploited process gets on the rest of the system. Web Application Firewalls may may be used to limit exposure of applications.

Segment externally facing servers and services from the rest of the network with a DMZ or on separate hosting infrastructure.

Use secure coding best practices when designing custom software that is meant for deployment to externally facing systems. Avoid issues documented by OWASP, CWE, and other software weakness identification efforts.

Regularly scan externally facing systems for vulnerabilities and establish procedures to rapidly patch systems when critical vulnerabilities are discovered through scanning and through public disclosure.","[{'url': 'https://attack.mitre.org/wiki/Technique/T1190', 'source_name': 'mitre-attack', 'external_id': 'T1190'}]","identity--c78cb6e5-0c4b-4611-8297-d1b8b55e40b5","2.1","2.1.0","['enterprise-attack']","identity--c78cb6e5-0c4b-4611-8297-d1b8b55e40b5","1.0"
"course-of-action","course-of-action--f2dcee22-c275-405e-87fd-48630a19dfba","2018-04-18T17:59:24.739Z","2018-04-18T17:59:24.739Z","Exploitation for Client Execution Mitigation","Browser sandboxes can be used to mitigate some of the impact of exploitation, but sandbox escapes may still exist. (Citation: Windows Blogs Microsoft Edge Sandbox) (Citation: Ars Technica Pwn2Own 2017 VM Escape)

Other types of virtualization and application microsegmentation may also mitigate the impact of client-side exploitation. The risks of additional exploits and weaknesses in implementation may still exist. (Citation: Ars Technica Pwn2Own 2017 VM Escape)

Security applications that look for behavior used during exploitation such as Windows Defender Exploit Guard (WDEG) and the Enhanced Mitigation Experience Toolkit (EMET) can be used to mitigate some exploitation behavior. (Citation: TechNet Moving Beyond EMET) Control flow integrity checking is another way to potentially identify and stop a software exploit from occurring. (Citation: Wikipedia Control Flow Integrity) Many of these protections depend on the architecture and target application binary for compatibility.","[{'url': 'https://attack.mitre.org/wiki/Technique/T1203', 'source_name': 'mitre-attack', 'external_id': 'T1203'}, {'description': 'Cowan, C. (2017, March 23). Strengthening the Microsoft Edge Sandbox. Retrieved March 12, 2018.', 'source_name': 'Windows Blogs Microsoft Edge Sandbox', 'url': 'https://blogs.windows.com/msedgedev/2017/03/23/strengthening-microsoft-edge-sandbox/'}, {'description': 'Goodin, D. (2017, March 17). Virtual machine escape fetches $105,000 at Pwn2Own hacking contest - updated. Retrieved March 12, 2018.', 'source_name': 'Ars Technica Pwn2Own 2017 VM Escape', 'url': 'https://arstechnica.com/information-technology/2017/03/hack-that-escapes-vm-by-exploiting-edge-browser-fetches-105000-at-pwn2own/'}, {'description': 'Nunez, N. (2017, August 9). Moving Beyond EMET II – Windows Defender Exploit Guard. Retrieved March 12, 2018.', 'source_name': 'TechNet Moving Beyond EMET', 'url': 'https://blogs.technet.microsoft.com/srd/2017/08/09/moving-beyond-emet-ii-windows-defender-exploit-guard/'}, {'description': 'Wikipedia. (2018, January 11). Control-flow integrity. Retrieved March 12, 2018.', 'source_name': 'Wikipedia Control Flow Integrity', 'url': 'https://en.wikipedia.org/wiki/Control-flow%20integrity'}]","identity--c78cb6e5-0c4b-4611-8297-d1b8b55e40b5","2.1","2.1.0","['enterprise-attack']","identity--c78cb6e5-0c4b-4611-8297-d1b8b55e40b5","1.0"
"course-of-action","course-of-action--06160d81-62be-46e5-aa37-4b9c645ffa31","2018-04-18T17:59:24.739Z","2018-04-18T17:59:24.739Z","Exploitation for Credential Access Mitigation","Update software regularly by employing patch management for internal enterprise endpoints and servers. Develop a robust cyber threat intelligence capability to determine what types and levels of threat may use software exploits and 0-days against a particular organization. Make it difficult for adversaries to advance their operation through exploitation of undiscovered or unpatched vulnerabilities by using sandboxing, if available. Other types of virtualization and application microsegmentation may also mitigate the impact of some types of exploitation. The risks of additional exploits and weaknesses in implementation may still exist. (Citation: Ars Technica Pwn2Own 2017 VM Escape)

Security applications that look for behavior used during exploitation such as Windows Defender Exploit Guard (WDEG) and the Enhanced Mitigation Experience Toolkit (EMET) can be used to mitigate some exploitation behavior. (Citation: TechNet Moving Beyond EMET) Control flow integrity checking is another way to potentially identify and stop a software exploit from occurring. (Citation: Wikipedia Control Flow Integrity) Many of these protections depend on the architecture and target application binary for compatibility and may not work for software targeted for defense evasion.","[{'url': 'https://attack.mitre.org/wiki/Technique/T1212', 'source_name': 'mitre-attack', 'external_id': 'T1212'}, {'description': 'Goodin, D. (2017, March 17). Virtual machine escape fetches $105,000 at Pwn2Own hacking contest - updated. Retrieved March 12, 2018.', 'source_name': 'Ars Technica Pwn2Own 2017 VM Escape', 'url': 'https://arstechnica.com/information-technology/2017/03/hack-that-escapes-vm-by-exploiting-edge-browser-fetches-105000-at-pwn2own/'}, {'description': 'Nunez, N. (2017, August 9). Moving Beyond EMET II – Windows Defender Exploit Guard. Retrieved March 12, 2018.', 'source_name': 'TechNet Moving Beyond EMET', 'url': 'https://blogs.technet.microsoft.com/srd/2017/08/09/moving-beyond-emet-ii-windows-defender-exploit-guard/'}, {'description': 'Wikipedia. (2018, January 11). Control-flow integrity. Retrieved March 12, 2018.', 'source_name': 'Wikipedia Control Flow Integrity', 'url': 'https://en.wikipedia.org/wiki/Control-flow%20integrity'}]","identity--c78cb6e5-0c4b-4611-8297-d1b8b55e40b5","2.1","2.1.0","['enterprise-attack']","identity--c78cb6e5-0c4b-4611-8297-d1b8b55e40b5","1.0"
