"type","id","created","modified","name","description","external_references","created_by_ref","spec_version","x_mitre_attack_spec_version","x_mitre_domains","x_mitre_modified_by_ref","x_mitre_version"
"course-of-action","course-of-action--f9b3e5d9-7454-4b7d-bce6-27620e19924e","2018-04-18T17:59:24.739Z","2018-04-18T17:59:24.739Z","Redundant Access Mitigation","Identify and block potentially malicious software that may be used as a remote access tool, and audit and/or block it by using whitelisting (Citation: Beechey 2010) tools, like AppLocker, (Citation: Windows Commands JPCERT) (Citation: NSA MS AppLocker) or Software Restriction Policies (Citation: Corio 2008) where appropriate. (Citation: TechNet Applocker vs SRP)

Network intrusion detection and prevention systems that use network signatures to identify traffic for specific adversary malware can be used to mitigate activity at the network level. Signatures are often for unique indicators within protocols and will be different across various malware families and versions. Adversaries will likely change tool signatures over time or construct protocols in such a way as to avoid detection by common defensive tools. (Citation: University of Birmingham C2)","[{'url': 'https://attack.mitre.org/wiki/Technique/T1108', 'source_name': 'mitre-attack', 'external_id': 'T1108'}, {'description': 'Beechey, J. (2010, December). Application Whitelisting: Panacea or Propaganda?. Retrieved November 18, 2014.', 'source_name': 'Beechey 2010', 'url': 'http://www.sans.org/reading-room/whitepapers/application/application-whitelisting-panacea-propaganda-33599'}, {'description': 'Tomonaga, S. (2016, January 26). Windows Commands Abused by Attackers. Retrieved February 2, 2016.', 'source_name': 'Windows Commands JPCERT', 'url': 'http://blog.jpcert.or.jp/2016/01/windows-commands-abused-by-attackers.html'}, {'description': 'NSA Information Assurance Directorate. (2014, August). Application Whitelisting Using Microsoft AppLocker. Retrieved March 31, 2016.', 'source_name': 'NSA MS AppLocker', 'url': 'https://www.iad.gov/iad/library/ia-guidance/tech-briefs/application-whitelisting-using-microsoft-applocker.cfm'}, {'description': 'Corio, C., & Sayana, D. P. (2008, June). Application Lockdown with Software Restriction Policies. Retrieved November 18, 2014.', 'source_name': 'Corio 2008', 'url': 'http://technet.microsoft.com/en-us/magazine/2008.06.srp.aspx'}, {'description': 'Microsoft. (2012, June 27). Using Software Restriction Policies and AppLocker Policies. Retrieved April 7, 2016.', 'source_name': 'TechNet Applocker vs SRP', 'url': 'https://technet.microsoft.com/en-us/library/ee791851.aspx'}, {'description': 'Gardiner, J.,  Cova, M., Nagaraja, S. (2014, February). Command & Control Understanding, Denying and Detecting. Retrieved April 20, 2016.', 'source_name': 'University of Birmingham C2', 'url': 'https://arxiv.org/ftp/arxiv/papers/1408/1408.1136.pdf'}]","identity--c78cb6e5-0c4b-4611-8297-d1b8b55e40b5","2.1","2.1.0","['enterprise-attack']","identity--c78cb6e5-0c4b-4611-8297-d1b8b55e40b5","1.0"
"course-of-action","course-of-action--8b36d944-f274-4d46-9acd-dbba6927ce7a","2018-04-18T17:59:24.739Z","2018-04-18T17:59:24.739Z","Registry Run Keys / Start Folder Mitigation","Identify and block potentially malicious software that may be executed through run key or startup folder persistence using whitelisting (Citation: Beechey 2010) tools like AppLocker (Citation: Windows Commands JPCERT) (Citation: NSA MS AppLocker) or Software Restriction Policies (Citation: Corio 2008) where appropriate. (Citation: TechNet Applocker vs SRP)","[{'url': 'https://attack.mitre.org/wiki/Technique/T1060', 'source_name': 'mitre-attack', 'external_id': 'T1060'}, {'description': 'Beechey, J. (2010, December). Application Whitelisting: Panacea or Propaganda?. Retrieved November 18, 2014.', 'source_name': 'Beechey 2010', 'url': 'http://www.sans.org/reading-room/whitepapers/application/application-whitelisting-panacea-propaganda-33599'}, {'description': 'Tomonaga, S. (2016, January 26). Windows Commands Abused by Attackers. Retrieved February 2, 2016.', 'source_name': 'Windows Commands JPCERT', 'url': 'http://blog.jpcert.or.jp/2016/01/windows-commands-abused-by-attackers.html'}, {'description': 'NSA Information Assurance Directorate. (2014, August). Application Whitelisting Using Microsoft AppLocker. Retrieved March 31, 2016.', 'source_name': 'NSA MS AppLocker', 'url': 'https://www.iad.gov/iad/library/ia-guidance/tech-briefs/application-whitelisting-using-microsoft-applocker.cfm'}, {'description': 'Corio, C., & Sayana, D. P. (2008, June). Application Lockdown with Software Restriction Policies. Retrieved November 18, 2014.', 'source_name': 'Corio 2008', 'url': 'http://technet.microsoft.com/en-us/magazine/2008.06.srp.aspx'}, {'description': 'Microsoft. (2012, June 27). Using Software Restriction Policies and AppLocker Policies. Retrieved April 7, 2016.', 'source_name': 'TechNet Applocker vs SRP', 'url': 'https://technet.microsoft.com/en-us/library/ee791851.aspx'}]","identity--c78cb6e5-0c4b-4611-8297-d1b8b55e40b5","2.1","2.1.0","['enterprise-attack']","identity--c78cb6e5-0c4b-4611-8297-d1b8b55e40b5","1.0"
"course-of-action","course-of-action--a90da496-b460-47e8-92e7-cc36eb00bd9a","2018-04-18T17:59:24.739Z","2018-04-18T17:59:24.739Z","Regsvcs/Regasm Mitigation","Regsvcs and Regasm may not be necessary within a given environment. Block execution of Regsvcs.exe and Regasm.exe if they are not required for a given system or network to prevent potential misuess by adversaries.","[{'url': 'https://attack.mitre.org/wiki/Technique/T1121', 'source_name': 'mitre-attack', 'external_id': 'T1121'}]","identity--c78cb6e5-0c4b-4611-8297-d1b8b55e40b5","2.1","2.1.0","['enterprise-attack']","identity--c78cb6e5-0c4b-4611-8297-d1b8b55e40b5","1.0"
"course-of-action","course-of-action--12c13879-b7bd-4bc5-8def-aacec386d432","2018-04-18T17:59:24.739Z","2018-04-18T17:59:24.739Z","Regsvr32 Mitigation","Microsoft's Enhanced Mitigation Experience Toolkit (EMET) Attack Surface Reduction (ASR) feature can be used to block regsvr32.exe from being used to bypass whitelisting. (Citation: Secure Host Baseline EMET)","[{'url': 'https://attack.mitre.org/wiki/Technique/T1117', 'source_name': 'mitre-attack', 'external_id': 'T1117'}, {'description': 'National Security Agency. (2016, May 4). Secure Host Baseline EMET. Retrieved June 22, 2016.', 'source_name': 'Secure Host Baseline EMET', 'url': 'https://github.com/iadgov/Secure-Host-Baseline/tree/master/EMET'}]","identity--c78cb6e5-0c4b-4611-8297-d1b8b55e40b5","2.1","2.1.0","['enterprise-attack']","identity--c78cb6e5-0c4b-4611-8297-d1b8b55e40b5","1.0"
"course-of-action","course-of-action--af093bc8-7b59-4e2a-9da8-8e839b4c50c6","2018-04-18T17:59:24.739Z","2018-04-18T17:59:24.739Z","Remote Access Tools Mitigation","Properly configure firewalls, application firewalls, and proxies to limit outgoing traffic to sites and services used by remote access tools.

Network intrusion detection and prevention systems that use network signatures may be able to prevent traffic to these services as well.

Use application whitelisting to mitigate use of and installation of unapproved software.","[{'url': 'https://attack.mitre.org/wiki/Technique/T1219', 'source_name': 'mitre-attack', 'external_id': 'T1219'}]","identity--c78cb6e5-0c4b-4611-8297-d1b8b55e40b5","2.1","2.1.0","['enterprise-attack']","identity--c78cb6e5-0c4b-4611-8297-d1b8b55e40b5","1.0"
"course-of-action","course-of-action--53b3b027-bed3-480c-9101-1247047d0fe6","2018-04-18T17:59:24.739Z","2018-04-18T17:59:24.739Z","Remote Desktop Protocol Mitigation","Disable the RDP service if it is unnecessary, remove unnecessary accounts and groups from Remote Desktop Users groups, and enable firewall rules to block RDP traffic between network security zones. Audit the Remote Desktop Users group membership regularly. Remove the local Administrators group from the list of groups allowed to log in through RDP. Limit remote user permissions if remote access is necessary. Use remote desktop gateways and multifactor authentication for remote logins. (Citation: Berkley Secure) Do not leave RDP accessible from the internet. Change GPOs to define shorter timeouts sessions and maximum amount of time any single session can be active. Change GPOs to specify the maximum amount of time that a disconnected session stays active on the RD session host server.  (Citation: Windows RDP Sessions)","[{'url': 'https://attack.mitre.org/wiki/Technique/T1076', 'source_name': 'mitre-attack', 'external_id': 'T1076'}, {'description': 'Berkeley Security, University of California. (n.d.). Securing Remote Desktop for System Administrators. Retrieved November 4, 2014.', 'source_name': 'Berkley Secure', 'url': 'https://security.berkeley.edu/node/94'}, {'description': 'Microsoft. (n.d.). Configure Timeout and Reconnection Settings for Remote Desktop Services Sessions. Retrieved December 11, 2017.', 'source_name': 'Windows RDP Sessions', 'url': 'https://technet.microsoft.com/en-us/library/cc754272(v=ws.11).aspx'}]","identity--c78cb6e5-0c4b-4611-8297-d1b8b55e40b5","2.1","2.1.0","['enterprise-attack']","identity--c78cb6e5-0c4b-4611-8297-d1b8b55e40b5","1.0"
"course-of-action","course-of-action--cdecc44a-1dbf-4c1f-881c-f21e3f47272a","2018-04-18T17:59:24.739Z","2018-04-18T17:59:24.739Z","Remote File Copy Mitigation","Network intrusion detection and prevention systems that use network signatures to identify traffic for specific adversary malware or unusual data transfer over known tools and protocols like FTP can be used to mitigate activity at the network level. Signatures are often for unique indicators within protocols and may be based on the specific obfuscation technique used by a particular adversary or tool, and will likely be different across various malware families and versions. Adversaries will likely change tool C2 signatures over time or construct protocols in such a way as to avoid detection by common defensive tools. (Citation: University of Birmingham C2)","[{'url': 'https://attack.mitre.org/wiki/Technique/T1105', 'source_name': 'mitre-attack', 'external_id': 'T1105'}, {'description': 'Gardiner, J.,  Cova, M., Nagaraja, S. (2014, February). Command & Control Understanding, Denying and Detecting. Retrieved April 20, 2016.', 'source_name': 'University of Birmingham C2', 'url': 'https://arxiv.org/ftp/arxiv/papers/1408/1408.1136.pdf'}]","identity--c78cb6e5-0c4b-4611-8297-d1b8b55e40b5","2.1","2.1.0","['enterprise-attack']","identity--c78cb6e5-0c4b-4611-8297-d1b8b55e40b5","1.0"
"course-of-action","course-of-action--979e6485-7a2f-42bd-ae96-4e622c3cd173","2018-04-18T17:59:24.739Z","2018-04-18T17:59:24.739Z","Remote Services Mitigation","Limit the number of accounts that may use remote services. Use multifactor authentication where possible. Limit the permissions for accounts that are at higher risk of compromise; for example, configure SSH so users can only run specific programs. Prevent Credential Access techniques that may allow an adversary to acquire Valid Accounts that can be used by existing services.","[{'url': 'https://attack.mitre.org/wiki/Technique/T1021', 'source_name': 'mitre-attack', 'external_id': 'T1021'}]","identity--c78cb6e5-0c4b-4611-8297-d1b8b55e40b5","2.1","2.1.0","['enterprise-attack']","identity--c78cb6e5-0c4b-4611-8297-d1b8b55e40b5","1.0"
"course-of-action","course-of-action--9a902722-cecd-4fbe-a6c9-49333aa0f8c2","2018-04-18T17:59:24.739Z","2018-04-18T17:59:24.739Z","Remote System Discovery Mitigation","Identify unnecessary system utilities or potentially malicious software that may be used to acquire information on remotely available systems, and audit and/or block them by using whitelisting (Citation: Beechey 2010) tools, like AppLocker, (Citation: Windows Commands JPCERT) (Citation: NSA MS AppLocker) or Software Restriction Policies (Citation: Corio 2008) where appropriate. (Citation: TechNet Applocker vs SRP)","[{'url': 'https://attack.mitre.org/wiki/Technique/T1018', 'source_name': 'mitre-attack', 'external_id': 'T1018'}, {'description': 'Beechey, J. (2010, December). Application Whitelisting: Panacea or Propaganda?. Retrieved November 18, 2014.', 'source_name': 'Beechey 2010', 'url': 'http://www.sans.org/reading-room/whitepapers/application/application-whitelisting-panacea-propaganda-33599'}, {'description': 'Tomonaga, S. (2016, January 26). Windows Commands Abused by Attackers. Retrieved February 2, 2016.', 'source_name': 'Windows Commands JPCERT', 'url': 'http://blog.jpcert.or.jp/2016/01/windows-commands-abused-by-attackers.html'}, {'description': 'NSA Information Assurance Directorate. (2014, August). Application Whitelisting Using Microsoft AppLocker. Retrieved March 31, 2016.', 'source_name': 'NSA MS AppLocker', 'url': 'https://www.iad.gov/iad/library/ia-guidance/tech-briefs/application-whitelisting-using-microsoft-applocker.cfm'}, {'description': 'Corio, C., & Sayana, D. P. (2008, June). Application Lockdown with Software Restriction Policies. Retrieved November 18, 2014.', 'source_name': 'Corio 2008', 'url': 'http://technet.microsoft.com/en-us/magazine/2008.06.srp.aspx'}, {'description': 'Microsoft. (2012, June 27). Using Software Restriction Policies and AppLocker Policies. Retrieved April 7, 2016.', 'source_name': 'TechNet Applocker vs SRP', 'url': 'https://technet.microsoft.com/en-us/library/ee791851.aspx'}]","identity--c78cb6e5-0c4b-4611-8297-d1b8b55e40b5","2.1","2.1.0","['enterprise-attack']","identity--c78cb6e5-0c4b-4611-8297-d1b8b55e40b5","1.0"
"course-of-action","course-of-action--effb83a0-ead1-4b36-b7f6-b7bdf9c4616e","2018-04-18T17:59:24.739Z","2018-04-18T17:59:24.739Z","Replication Through Removable Media Mitigation","Disable Autorun if it is unnecessary. (Citation: Microsoft Disable Autorun) Disallow or restrict removable media at an organizational policy level if it is not required for business operations. (Citation: TechNet Removable Media Control)

Identify potentially malicious software that may be used to infect removable media or may result from tainted removable media, and audit and/or block it by using whitelisting (Citation: Beechey 2010) tools, like AppLocker, (Citation: Windows Commands JPCERT) (Citation: NSA MS AppLocker) or Software Restriction Policies (Citation: Corio 2008) where appropriate. (Citation: TechNet Applocker vs SRP)","[{'url': 'https://attack.mitre.org/wiki/Technique/T1091', 'source_name': 'mitre-attack', 'external_id': 'T1091'}, {'description': 'Microsoft. (n.d.). How to disable the Autorun functionality in Windows. Retrieved April 20, 2016.', 'source_name': 'Microsoft Disable Autorun', 'url': 'https://support.microsoft.com/en-us/kb/967715'}, {'description': 'Microsoft. (2007, August 31). https://technet.microsoft.com/en-us/library/cc771759(v=ws.10).aspx. Retrieved April 20, 2016.', 'source_name': 'TechNet Removable Media Control', 'url': 'https://technet.microsoft.com/en-us/library/cc772540(v=ws.10).aspx'}, {'description': 'Beechey, J. (2010, December). Application Whitelisting: Panacea or Propaganda?. Retrieved November 18, 2014.', 'source_name': 'Beechey 2010', 'url': 'http://www.sans.org/reading-room/whitepapers/application/application-whitelisting-panacea-propaganda-33599'}, {'description': 'Tomonaga, S. (2016, January 26). Windows Commands Abused by Attackers. Retrieved February 2, 2016.', 'source_name': 'Windows Commands JPCERT', 'url': 'http://blog.jpcert.or.jp/2016/01/windows-commands-abused-by-attackers.html'}, {'description': 'NSA Information Assurance Directorate. (2014, August). Application Whitelisting Using Microsoft AppLocker. Retrieved March 31, 2016.', 'source_name': 'NSA MS AppLocker', 'url': 'https://www.iad.gov/iad/library/ia-guidance/tech-briefs/application-whitelisting-using-microsoft-applocker.cfm'}, {'description': 'Corio, C., & Sayana, D. P. (2008, June). Application Lockdown with Software Restriction Policies. Retrieved November 18, 2014.', 'source_name': 'Corio 2008', 'url': 'http://technet.microsoft.com/en-us/magazine/2008.06.srp.aspx'}, {'description': 'Microsoft. (2012, June 27). Using Software Restriction Policies and AppLocker Policies. Retrieved April 7, 2016.', 'source_name': 'TechNet Applocker vs SRP', 'url': 'https://technet.microsoft.com/en-us/library/ee791851.aspx'}]","identity--c78cb6e5-0c4b-4611-8297-d1b8b55e40b5","2.1","2.1.0","['enterprise-attack']","identity--c78cb6e5-0c4b-4611-8297-d1b8b55e40b5","1.0"
"course-of-action","course-of-action--95ddb356-7ba0-4bd9-a889-247262b8946f","2018-04-18T17:59:24.739Z","2018-04-18T17:59:24.739Z","Rootkit Mitigation","Identify potentially malicious software that may contain rootkit functionality, and audit and/or block it by using whitelisting (Citation: Beechey 2010) tools, like AppLocker, (Citation: Windows Commands JPCERT) (Citation: NSA MS AppLocker) or Software Restriction Policies (Citation: Corio 2008) where appropriate. (Citation: TechNet Applocker vs SRP)","[{'url': 'https://attack.mitre.org/wiki/Technique/T1014', 'source_name': 'mitre-attack', 'external_id': 'T1014'}, {'description': 'Beechey, J. (2010, December). Application Whitelisting: Panacea or Propaganda?. Retrieved November 18, 2014.', 'source_name': 'Beechey 2010', 'url': 'http://www.sans.org/reading-room/whitepapers/application/application-whitelisting-panacea-propaganda-33599'}, {'description': 'Tomonaga, S. (2016, January 26). Windows Commands Abused by Attackers. Retrieved February 2, 2016.', 'source_name': 'Windows Commands JPCERT', 'url': 'http://blog.jpcert.or.jp/2016/01/windows-commands-abused-by-attackers.html'}, {'description': 'NSA Information Assurance Directorate. (2014, August). Application Whitelisting Using Microsoft AppLocker. Retrieved March 31, 2016.', 'source_name': 'NSA MS AppLocker', 'url': 'https://www.iad.gov/iad/library/ia-guidance/tech-briefs/application-whitelisting-using-microsoft-applocker.cfm'}, {'description': 'Corio, C., & Sayana, D. P. (2008, June). Application Lockdown with Software Restriction Policies. Retrieved November 18, 2014.', 'source_name': 'Corio 2008', 'url': 'http://technet.microsoft.com/en-us/magazine/2008.06.srp.aspx'}, {'description': 'Microsoft. (2012, June 27). Using Software Restriction Policies and AppLocker Policies. Retrieved April 7, 2016.', 'source_name': 'TechNet Applocker vs SRP', 'url': 'https://technet.microsoft.com/en-us/library/ee791851.aspx'}]","identity--c78cb6e5-0c4b-4611-8297-d1b8b55e40b5","2.1","2.1.0","['enterprise-attack']","identity--c78cb6e5-0c4b-4611-8297-d1b8b55e40b5","1.0"
"course-of-action","course-of-action--8c918d8a-11c5-4ffd-af10-e74bc06bdfae","2018-04-18T17:59:24.739Z","2018-04-18T17:59:24.739Z","Rundll32 Mitigation","Microsoft's Enhanced Mitigation Experience Toolkit (EMET) Attack Surface Reduction (ASR) feature can be used to block methods of using rundll32.exe to bypass whitelisting. (Citation: Secure Host Baseline EMET)","[{'url': 'https://attack.mitre.org/wiki/Technique/T1085', 'source_name': 'mitre-attack', 'external_id': 'T1085'}, {'description': 'National Security Agency. (2016, May 4). Secure Host Baseline EMET. Retrieved June 22, 2016.', 'source_name': 'Secure Host Baseline EMET', 'url': 'https://github.com/iadgov/Secure-Host-Baseline/tree/master/EMET'}]","identity--c78cb6e5-0c4b-4611-8297-d1b8b55e40b5","2.1","2.1.0","['enterprise-attack']","identity--c78cb6e5-0c4b-4611-8297-d1b8b55e40b5","1.0"
"course-of-action","course-of-action--b91c2f9e-c1a0-44df-95f0-9e7c9d1d5e55","2018-04-18T17:59:24.739Z","2018-04-18T17:59:24.739Z","SID-History Injection Mitigation","Clean up SID-History attributes after legitimate account migration is complete.

Apply SID Filtering to domain trusts to exclude SID-History from requests to access domain resources (`netdom trust <TrustingDomainName> /domain:<TrustedDomainName> /quarantine:yes` (Citation: Microsoft Netdom Trust Sept 2012) on the domain controller). Domain SID Filtering is disabled by default.

Apply SID Filtering to forest trusts to exclude SID-History from request to access forest resources (`netdom trust <TrustingDomainName> /domain:<TrustedDomainName> /EnableSIDHistory:no` (Citation: Microsoft Netdom Trust Sept 2012) on the domain controller). Forest SID Filtering is active by default, but may block child domains from transitively accessesing the forest trust.

Ensure SID Filter Quarantining is enabled on trusted external domains (`netdom trust <TrustingDomainName> /domain:<TrustedDomainName> /quarantine` (Citation: Microsoft Netdom Trust Sept 2012) on the domain controller) to ensure authentication requests only include SIDs from that domain. SID Filter Quarantining is automatically enabled on all created external trusts using Server 2003 or later domain controllers. (Citation: Microsoft Trust Considerations Nov 2014) (Citation: Microsoft SID) Filtering Quarantining Jan 2009","[{'url': 'https://attack.mitre.org/wiki/Technique/T1178', 'source_name': 'mitre-attack', 'external_id': 'T1178'}, {'description': 'Microsoft. (n.d.). Security Identifiers. Retrieved November 30, 2017.', 'source_name': 'Microsoft SID', 'url': 'https://msdn.microsoft.com/library/windows/desktop/aa379571.aspx'}, {'description': 'Microsoft. (2012, September 11). Command-Line Reference - Netdom Trust. Retrieved November 30, 2017.', 'source_name': 'Microsoft Netdom Trust Sept 2012', 'url': 'https://technet.microsoft.com/library/cc835085.aspx'}, {'description': 'Microsoft. (2014, November 19). Security Considerations for Trusts. Retrieved November 30, 2017.', 'source_name': 'Microsoft Trust Considerations Nov 2014', 'url': 'https://technet.microsoft.com/library/cc755321.aspx'}]","identity--c78cb6e5-0c4b-4611-8297-d1b8b55e40b5","2.1","2.1.0","['enterprise-attack']","identity--c78cb6e5-0c4b-4611-8297-d1b8b55e40b5","1.0"
"course-of-action","course-of-action--ef273807-c465-4728-9cee-5823422f42ee","2018-04-18T17:59:24.739Z","2018-04-18T17:59:24.739Z","SIP and Trust Provider Hijacking Mitigation","Ensure proper permissions are set for Registry hives to prevent users from modifying keys related to SIP and trust provider components. Also ensure that these values contain their full path to prevent DLL Search Order Hijacking. (Citation: SpectorOps Subverting Trust Sept 2017)

Consider removing unnecessary and/or stale SIPs. (Citation: SpectorOps Subverting Trust Sept 2017)

Restrict storage and execution of SIP DLLs to protected directories, such as C:\Windows, rather than user directories.

Enable whitelisting solutions such as AppLocker and/or Device Guard to block the loading of malicious SIP DLLs. Components may still be able to be hijacked to suitable functions already present on disk if malicious modifications to Registry keys are not prevented.","[{'url': 'https://attack.mitre.org/wiki/Technique/T1198', 'source_name': 'mitre-attack', 'external_id': 'T1198'}, {'description': 'Graeber, M. (2017, September). Subverting Trust in Windows. Retrieved January 31, 2018.', 'source_name': 'SpectorOps Subverting Trust Sept 2017', 'url': 'https://specterops.io/assets/resources/SpecterOps%20Subverting%20Trust%20in%20Windows.pdf'}]","identity--c78cb6e5-0c4b-4611-8297-d1b8b55e40b5","2.1","2.1.0","['enterprise-attack']","identity--c78cb6e5-0c4b-4611-8297-d1b8b55e40b5","1.0"
"course-of-action","course-of-action--41cff8e9-fd05-408e-b3d5-d98c54c20bcf","2018-04-18T17:59:24.739Z","2018-04-18T17:59:24.739Z","SSH Hijacking Mitigation","Ensure SSH key pairs have strong passwords and refrain from using key-store technologies such as ssh-agent unless they are properly protected. Ensure that all private keys are stored securely in locations where only the legitimate owner has access to with strong passwords and are rotated frequently. Ensure proper file permissions are set and harden system to prevent root privilege escalation opportunities. Do not allow remote access via SSH as root or other privileged accounts. Ensure that agent forwarding is disabled on systems that do not explicitly require this feature to prevent misuse. (Citation: Symantec SSH and ssh-agent)","[{'url': 'https://attack.mitre.org/wiki/Technique/T1184', 'source_name': 'mitre-attack', 'external_id': 'T1184'}, {'description': 'Hatch, B. (2004, November 22). SSH and ssh-agent. Retrieved January 8, 2018.', 'source_name': 'Symantec SSH and ssh-agent', 'url': 'https://www.symantec.com/connect/articles/ssh-and-ssh-agent'}]","identity--c78cb6e5-0c4b-4611-8297-d1b8b55e40b5","2.1","2.1.0","['enterprise-attack']","identity--c78cb6e5-0c4b-4611-8297-d1b8b55e40b5","1.0"
