"type","id","created","modified","name","description","external_references","created_by_ref","spec_version","x_mitre_attack_spec_version","x_mitre_domains","x_mitre_modified_by_ref","x_mitre_version"
"course-of-action","course-of-action--54246e2e-683f-4bf2-be4c-d7d5a60e7d22","2018-04-18T17:59:24.739Z","2018-04-18T17:59:24.739Z","LLMNR/NBT-NS Poisoning Mitigation","Disable LLMNR and NetBIOS in local computer security settings or by group policy if they are not needed within an environment. (Citation: ADSecurity Windows Secure Baseline)

Use host-based security software to block LLMNR/NetBIOS traffic.","[{'url': 'https://attack.mitre.org/wiki/Technique/T1171', 'source_name': 'mitre-attack', 'external_id': 'T1171'}, {'description': 'Metcalf, S. (2016, October 21). Securing Windows Workstations: Developing a Secure Baseline. Retrieved November 17, 2017.', 'source_name': 'ADSecurity Windows Secure Baseline', 'url': 'https://adsecurity.org/?p=3299'}]","identity--c78cb6e5-0c4b-4611-8297-d1b8b55e40b5","2.1","2.1.0","['enterprise-attack']","identity--c78cb6e5-0c4b-4611-8297-d1b8b55e40b5","1.0"
"course-of-action","course-of-action--7a6e5ca3-562f-4185-a323-f3b62b5b2e6b","2018-04-18T17:59:24.739Z","2018-04-18T17:59:24.739Z","LSASS Driver Mitigation","On Windows 8.1 and Server 2012 R2, enable LSA Protection by setting the Registry key `HKEY_LOCAL_MACHINE\SYSTEM\CurrentControlSet\Control\Lsa\RunAsPPL` to `dword:00000001`. (Citation: Microsoft LSA Protection Mar 2014) LSA Protection ensures that LSA plug-ins and drivers are only loaded if they are digitally signed with a Microsoft signature and adhere to the Microsoft Security Development Lifecycle (SDL) process guidance.

On Windows 10 and Server 2016, enable Windows Defender Credential Guard (Citation: Microsoft Enable Cred Guard April 2017) to run lsass.exe in an isolated virtualized environment without any device drivers. (Citation: Microsoft Credential Guard April 2017)

Ensure safe DLL search mode is enabled `HKEY_LOCAL_MACHINE\System\CurrentControlSet\Control\Session Manager\SafeDllSearchMode` to mitigate risk that lsass.exe loads a malicious code library. (Citation: Microsoft DLL Security)","[{'url': 'https://attack.mitre.org/wiki/Technique/T1177', 'source_name': 'mitre-attack', 'external_id': 'T1177'}, {'description': 'Microsoft. (2014, March 12). Configuring Additional LSA Protection. Retrieved November 27, 2017.', 'source_name': 'Microsoft LSA Protection Mar 2014', 'url': 'https://technet.microsoft.com/library/dn408187.aspx'}, {'description': 'Lich, B., Tobin, J., Hall, J. (2017, April 5). Manage Windows Defender Credential Guard. Retrieved November 27, 2017.', 'source_name': 'Microsoft Enable Cred Guard April 2017', 'url': 'https://docs.microsoft.com/windows/access-protection/credential-guard/credential-guard-manage'}, {'description': 'Lich, B., Tobin, J. (2017, April 5). How Windows Defender Credential Guard works. Retrieved November 27, 2017.', 'source_name': 'Microsoft Credential Guard April 2017', 'url': 'https://docs.microsoft.com/windows/access-protection/credential-guard/credential-guard-how-it-works'}, {'description': 'Microsoft. (n.d.). Dynamic-Link Library Security. Retrieved November 27, 2017.', 'source_name': 'Microsoft DLL Security', 'url': 'https://msdn.microsoft.com/library/windows/desktop/ff919712.aspx'}]","identity--c78cb6e5-0c4b-4611-8297-d1b8b55e40b5","2.1","2.1.0","['enterprise-attack']","identity--c78cb6e5-0c4b-4611-8297-d1b8b55e40b5","1.0"
"course-of-action","course-of-action--121b2863-5b97-4538-acb3-f8aae070ec13","2018-04-18T17:59:24.739Z","2018-04-18T17:59:24.739Z","Launch Agent Mitigation","Restrict user's abilities to create Launch Agents with group policy.","[{'url': 'https://attack.mitre.org/wiki/Technique/T1159', 'source_name': 'mitre-attack', 'external_id': 'T1159'}]","identity--c78cb6e5-0c4b-4611-8297-d1b8b55e40b5","2.1","2.1.0","['enterprise-attack']","identity--c78cb6e5-0c4b-4611-8297-d1b8b55e40b5","1.0"
"course-of-action","course-of-action--402e92cd-5608-4f4b-9a34-a2c962e4bcd7","2018-04-18T17:59:24.739Z","2018-04-18T17:59:24.739Z","Launch Daemon Mitigation","Limit privileges of user accounts and remediate Privilege Escalation vectors so only authorized administrators can create new Launch Daemons.","[{'url': 'https://attack.mitre.org/wiki/Technique/T1160', 'source_name': 'mitre-attack', 'external_id': 'T1160'}]","identity--c78cb6e5-0c4b-4611-8297-d1b8b55e40b5","2.1","2.1.0","['enterprise-attack']","identity--c78cb6e5-0c4b-4611-8297-d1b8b55e40b5","1.0"
"course-of-action","course-of-action--e333cf16-5bfa-453e-8e6a-3a4c63d6bfcc","2018-04-18T17:59:24.739Z","2018-04-18T17:59:24.739Z","Launchctl Mitigation","Prevent users from installing their own launch agents or launch daemons and instead require them to be pushed out by group policy.","[{'url': 'https://attack.mitre.org/wiki/Technique/T1152', 'source_name': 'mitre-attack', 'external_id': 'T1152'}]","identity--c78cb6e5-0c4b-4611-8297-d1b8b55e40b5","2.1","2.1.0","['enterprise-attack']","identity--c78cb6e5-0c4b-4611-8297-d1b8b55e40b5","1.0"
"course-of-action","course-of-action--c47a9b55-8f61-4b82-b833-1db6242c754e","2018-04-18T17:59:24.739Z","2018-04-18T17:59:24.739Z","Local Job Scheduling Mitigation","Limit privileges of user accounts and remediate Privilege Escalation vectors so only authorized users can create scheduled jobs. Identify and block unnecessary system utilities or potentially malicious software that may be used to schedule jobs using whitelisting tools.","[{'url': 'https://attack.mitre.org/wiki/Technique/T1168', 'source_name': 'mitre-attack', 'external_id': 'T1168'}]","identity--c78cb6e5-0c4b-4611-8297-d1b8b55e40b5","2.1","2.1.0","['enterprise-attack']","identity--c78cb6e5-0c4b-4611-8297-d1b8b55e40b5","1.0"
"course-of-action","course-of-action--06824aa2-94a5-474c-97f6-57c2e983d885","2018-04-18T17:59:24.739Z","2018-04-18T17:59:24.739Z","Login Item Mitigation","Restrict users from being able to create their own login items. Additionally, holding the shift key during login prevents apps from opening automatically (Citation: Re-Open windows on Mac).","[{'url': 'https://attack.mitre.org/wiki/Technique/T1162', 'source_name': 'mitre-attack', 'external_id': 'T1162'}, {'description': 'Apple. (2016, December 6). Automatically re-open windows, apps, and documents on your Mac. Retrieved July 11, 2017.', 'source_name': 'Re-Open windows on Mac', 'url': 'https://support.apple.com/en-us/HT204005'}]","identity--c78cb6e5-0c4b-4611-8297-d1b8b55e40b5","2.1","2.1.0","['enterprise-attack']","identity--c78cb6e5-0c4b-4611-8297-d1b8b55e40b5","1.0"
"course-of-action","course-of-action--9ab7de33-99b2-4d8d-8cf3-182fa0015cc2","2018-04-18T17:59:24.739Z","2018-04-18T17:59:24.739Z","Logon Scripts Mitigation","Restrict write access to logon scripts to specific administrators. Prevent access to administrator accounts by mitigating Credential Access techniques and limiting account access and permissions of Valid Accounts.

Identify and block potentially malicious software that may be executed through logon script modification by using whitelisting (Citation: Beechey 2010) tools like AppLocker (Citation: Windows Commands JPCERT) (Citation: NSA MS AppLocker) that are capable of auditing and/or blocking unknown programs.","[{'url': 'https://attack.mitre.org/wiki/Technique/T1037', 'source_name': 'mitre-attack', 'external_id': 'T1037'}, {'description': 'Beechey, J. (2010, December). Application Whitelisting: Panacea or Propaganda?. Retrieved November 18, 2014.', 'source_name': 'Beechey 2010', 'url': 'http://www.sans.org/reading-room/whitepapers/application/application-whitelisting-panacea-propaganda-33599'}, {'description': 'Tomonaga, S. (2016, January 26). Windows Commands Abused by Attackers. Retrieved February 2, 2016.', 'source_name': 'Windows Commands JPCERT', 'url': 'http://blog.jpcert.or.jp/2016/01/windows-commands-abused-by-attackers.html'}, {'description': 'NSA Information Assurance Directorate. (2014, August). Application Whitelisting Using Microsoft AppLocker. Retrieved March 31, 2016.', 'source_name': 'NSA MS AppLocker', 'url': 'https://www.iad.gov/iad/library/ia-guidance/tech-briefs/application-whitelisting-using-microsoft-applocker.cfm'}]","identity--c78cb6e5-0c4b-4611-8297-d1b8b55e40b5","2.1","2.1.0","['enterprise-attack']","identity--c78cb6e5-0c4b-4611-8297-d1b8b55e40b5","1.0"
"course-of-action","course-of-action--94f6b4f5-b528-4f50-91d5-f66457c2f8f7","2018-04-18T17:59:24.739Z","2018-04-18T17:59:24.739Z","Man in the Browser Mitigation","Since browser pivoting requires a high integrity process to launch from, restricting user permissions and addressing Privilege Escalation and Bypass User Account Control opportunities can limit the exposure to this technique. 

Close all browser sessions regularly and when they are no longer needed.","[{'url': 'https://attack.mitre.org/wiki/Technique/T1185', 'source_name': 'mitre-attack', 'external_id': 'T1185'}]","identity--c78cb6e5-0c4b-4611-8297-d1b8b55e40b5","2.1","2.1.0","['enterprise-attack']","identity--c78cb6e5-0c4b-4611-8297-d1b8b55e40b5","1.0"
"course-of-action","course-of-action--45e7f570-6a0b-4095-bf02-4bca05da6bae","2018-04-18T17:59:24.739Z","2018-04-18T17:59:24.739Z","Masquerading Mitigation","When creating security rules, avoid exclusions based on file name or file path. Require signed binaries. Use file system access controls to protect folders such as C:\Windows\System32. Use tools that restrict program execution via whitelisting by attributes other than file name.

Identify potentially malicious software that may look like a legitimate program based on name and location, and audit and/or block it by using whitelisting (Citation: Beechey 2010) tools like AppLocker (Citation: Windows Commands JPCERT) (Citation: NSA MS AppLocker) or Software Restriction Policies (Citation: Corio 2008) where appropriate. (Citation: TechNet Applocker vs SRP)","[{'url': 'https://attack.mitre.org/wiki/Technique/T1036', 'source_name': 'mitre-attack', 'external_id': 'T1036'}, {'description': 'Beechey, J. (2010, December). Application Whitelisting: Panacea or Propaganda?. Retrieved November 18, 2014.', 'source_name': 'Beechey 2010', 'url': 'http://www.sans.org/reading-room/whitepapers/application/application-whitelisting-panacea-propaganda-33599'}, {'description': 'Tomonaga, S. (2016, January 26). Windows Commands Abused by Attackers. Retrieved February 2, 2016.', 'source_name': 'Windows Commands JPCERT', 'url': 'http://blog.jpcert.or.jp/2016/01/windows-commands-abused-by-attackers.html'}, {'description': 'NSA Information Assurance Directorate. (2014, August). Application Whitelisting Using Microsoft AppLocker. Retrieved March 31, 2016.', 'source_name': 'NSA MS AppLocker', 'url': 'https://www.iad.gov/iad/library/ia-guidance/tech-briefs/application-whitelisting-using-microsoft-applocker.cfm'}, {'description': 'Corio, C., & Sayana, D. P. (2008, June). Application Lockdown with Software Restriction Policies. Retrieved November 18, 2014.', 'source_name': 'Corio 2008', 'url': 'http://technet.microsoft.com/en-us/magazine/2008.06.srp.aspx'}, {'description': 'Microsoft. (2012, June 27). Using Software Restriction Policies and AppLocker Policies. Retrieved April 7, 2016.', 'source_name': 'TechNet Applocker vs SRP', 'url': 'https://technet.microsoft.com/en-us/library/ee791851.aspx'}]","identity--c78cb6e5-0c4b-4611-8297-d1b8b55e40b5","2.1","2.1.0","['enterprise-attack']","identity--c78cb6e5-0c4b-4611-8297-d1b8b55e40b5","1.0"
"course-of-action","course-of-action--fe0aeb41-1a51-4152-8467-628256ea6adf","2018-04-18T17:59:24.739Z","2018-04-18T17:59:24.739Z","Modify Existing Service Mitigation","Use auditing tools capable of detecting privilege and service abuse opportunities on systems within an enterprise and correct them. Limit privileges of user accounts and groups so that only authorized administrators can interact with service changes and service configurations. Toolkits like the PowerSploit framework contain the PowerUp modules that can be used to explore systems for Privilege Escalation weaknesses. (Citation: Powersploit)

Identify and block potentially malicious software that may be executed through service abuse by using whitelisting (Citation: Beechey 2010) tools like AppLocker (Citation: Windows Commands JPCERT) (Citation: NSA MS AppLocker) that are capable of auditing and/or blocking unknown programs.","[{'url': 'https://attack.mitre.org/wiki/Technique/T1031', 'source_name': 'mitre-attack', 'external_id': 'T1031'}, {'description': 'PowerSploit. (n.d.).  Retrieved December 4, 2014.', 'source_name': 'Powersploit', 'url': 'https://github.com/mattifestation/PowerSploit'}, {'description': 'Beechey, J. (2010, December). Application Whitelisting: Panacea or Propaganda?. Retrieved November 18, 2014.', 'source_name': 'Beechey 2010', 'url': 'http://www.sans.org/reading-room/whitepapers/application/application-whitelisting-panacea-propaganda-33599'}, {'description': 'Tomonaga, S. (2016, January 26). Windows Commands Abused by Attackers. Retrieved February 2, 2016.', 'source_name': 'Windows Commands JPCERT', 'url': 'http://blog.jpcert.or.jp/2016/01/windows-commands-abused-by-attackers.html'}, {'description': 'NSA Information Assurance Directorate. (2014, August). Application Whitelisting Using Microsoft AppLocker. Retrieved March 31, 2016.', 'source_name': 'NSA MS AppLocker', 'url': 'https://www.iad.gov/iad/library/ia-guidance/tech-briefs/application-whitelisting-using-microsoft-applocker.cfm'}]","identity--c78cb6e5-0c4b-4611-8297-d1b8b55e40b5","2.1","2.1.0","['enterprise-attack']","identity--c78cb6e5-0c4b-4611-8297-d1b8b55e40b5","1.0"
"course-of-action","course-of-action--ed202147-4026-4330-b5bd-1e8dfa8cf7cc","2018-04-18T17:59:24.739Z","2018-04-18T17:59:24.739Z","Modify Registry Mitigation","Misconfiguration of permissions in the Registry may lead to opportunities for an adversary to execute code, like through Service Registry Permissions Weakness. Ensure proper permissions are set for Registry hives to prevent users from modifying keys for system components that may lead to privilege escalation.

Identify and block unnecessary system utilities or potentially malicious software that may be used to modify the Registry by using whitelisting (Citation: Beechey 2010) tools like AppLocker (Citation: Windows Commands JPCERT) (Citation: NSA MS AppLocker) or Software Restriction Policies (Citation: Corio 2008) where appropriate. (Citation: TechNet Applocker vs SRP)","[{'url': 'https://attack.mitre.org/wiki/Technique/T1112', 'source_name': 'mitre-attack', 'external_id': 'T1112'}, {'description': 'Beechey, J. (2010, December). Application Whitelisting: Panacea or Propaganda?. Retrieved November 18, 2014.', 'source_name': 'Beechey 2010', 'url': 'http://www.sans.org/reading-room/whitepapers/application/application-whitelisting-panacea-propaganda-33599'}, {'description': 'Tomonaga, S. (2016, January 26). Windows Commands Abused by Attackers. Retrieved February 2, 2016.', 'source_name': 'Windows Commands JPCERT', 'url': 'http://blog.jpcert.or.jp/2016/01/windows-commands-abused-by-attackers.html'}, {'description': 'NSA Information Assurance Directorate. (2014, August). Application Whitelisting Using Microsoft AppLocker. Retrieved March 31, 2016.', 'source_name': 'NSA MS AppLocker', 'url': 'https://www.iad.gov/iad/library/ia-guidance/tech-briefs/application-whitelisting-using-microsoft-applocker.cfm'}, {'description': 'Corio, C., & Sayana, D. P. (2008, June). Application Lockdown with Software Restriction Policies. Retrieved November 18, 2014.', 'source_name': 'Corio 2008', 'url': 'http://technet.microsoft.com/en-us/magazine/2008.06.srp.aspx'}, {'description': 'Microsoft. (2012, June 27). Using Software Restriction Policies and AppLocker Policies. Retrieved April 7, 2016.', 'source_name': 'TechNet Applocker vs SRP', 'url': 'https://technet.microsoft.com/en-us/library/ee791851.aspx'}]","identity--c78cb6e5-0c4b-4611-8297-d1b8b55e40b5","2.1","2.1.0","['enterprise-attack']","identity--c78cb6e5-0c4b-4611-8297-d1b8b55e40b5","1.0"
"course-of-action","course-of-action--d2dce10b-3562-4d61-b2f5-7c6384b038e2","2018-04-18T17:59:24.739Z","2018-04-18T17:59:24.739Z","Mshta Mitigation","Mshta.exe may not be necessary within a given environment since its functionality is tied to older versions of Internet Explorer which have reached end of life. Use application whitelisting configured to block execution of mshta.exe if it is not required for a given system or network to prevent potential misuse by adversaries.","[{'url': 'https://attack.mitre.org/wiki/Technique/T1170', 'source_name': 'mitre-attack', 'external_id': 'T1170'}]","identity--c78cb6e5-0c4b-4611-8297-d1b8b55e40b5","2.1","2.1.0","['enterprise-attack']","identity--c78cb6e5-0c4b-4611-8297-d1b8b55e40b5","1.0"
"course-of-action","course-of-action--514e7371-a344-4de7-8ec3-3aa42b801d52","2018-04-18T17:59:24.739Z","2018-04-18T17:59:24.739Z","Multi-Stage Channels Mitigation","Command and control infrastructure used in a multi-stage channel may be blocked if known ahead of time. If unique signatures are present in the C2 traffic, they could also be used as the basis of identifying and blocking the channel. (Citation: University of Birmingham C2)","[{'url': 'https://attack.mitre.org/wiki/Technique/T1104', 'source_name': 'mitre-attack', 'external_id': 'T1104'}, {'description': 'Gardiner, J.,  Cova, M., Nagaraja, S. (2014, February). Command & Control Understanding, Denying and Detecting. Retrieved April 20, 2016.', 'source_name': 'University of Birmingham C2', 'url': 'https://arxiv.org/ftp/arxiv/papers/1408/1408.1136.pdf'}]","identity--c78cb6e5-0c4b-4611-8297-d1b8b55e40b5","2.1","2.1.0","['enterprise-attack']","identity--c78cb6e5-0c4b-4611-8297-d1b8b55e40b5","1.0"
"course-of-action","course-of-action--752db800-ea54-4e7a-b4c1-2a0292350ea7","2018-04-18T17:59:24.739Z","2018-04-18T17:59:24.739Z","Multi-hop Proxy Mitigation","Traffic to known anonymity networks and C2 infrastructure can be blocked through the use of network black and white lists. It should be noted that this kind of blocking may be circumvented by other techniques like Domain Fronting.","[{'url': 'https://attack.mitre.org/wiki/Technique/T1188', 'source_name': 'mitre-attack', 'external_id': 'T1188'}]","identity--c78cb6e5-0c4b-4611-8297-d1b8b55e40b5","2.1","2.1.0","['enterprise-attack']","identity--c78cb6e5-0c4b-4611-8297-d1b8b55e40b5","1.0"
"course-of-action","course-of-action--da987565-27b6-4b31-bbcd-74b909847116","2018-04-18T17:59:24.739Z","2018-04-18T17:59:24.739Z","Multiband Communication Mitigation","Network intrusion detection and prevention systems that use network signatures to identify traffic for specific adversary malware can be used to mitigate activity at the network level. Signatures are often for unique indicators within protocols and may be based on the specific protocol used by a particular adversary or tool, and will likely be different across various malware families and versions. Adversaries will likely change tool C2 signatures over time or construct protocols in such a way as to avoid detection by common defensive tools. (Citation: University of Birmingham C2)","[{'url': 'https://attack.mitre.org/wiki/Technique/T1026', 'source_name': 'mitre-attack', 'external_id': 'T1026'}, {'description': 'Gardiner, J.,  Cova, M., Nagaraja, S. (2014, February). Command & Control Understanding, Denying and Detecting. Retrieved April 20, 2016.', 'source_name': 'University of Birmingham C2', 'url': 'https://arxiv.org/ftp/arxiv/papers/1408/1408.1136.pdf'}]","identity--c78cb6e5-0c4b-4611-8297-d1b8b55e40b5","2.1","2.1.0","['enterprise-attack']","identity--c78cb6e5-0c4b-4611-8297-d1b8b55e40b5","1.0"
"course-of-action","course-of-action--24478001-2eb3-4b06-a02e-96b3d61d27ec","2018-04-18T17:59:24.739Z","2018-04-18T17:59:24.739Z","Multilayer Encryption Mitigation","Network intrusion detection and prevention systems that use network signatures to identify traffic for specific adversary malware can be used to mitigate activity at the network level. Use of encryption protocols may make typical network-based C2 detection more difficult due to a reduced ability to signature the traffic. Prior knowledge of adversary C2 infrastructure may be useful for domain and IP address blocking, but will likely not be an effective long-term solution because adversaries can change infrastructure often. (Citation: University of Birmingham C2)","[{'url': 'https://attack.mitre.org/wiki/Technique/T1079', 'source_name': 'mitre-attack', 'external_id': 'T1079'}, {'description': 'Gardiner, J.,  Cova, M., Nagaraja, S. (2014, February). Command & Control Understanding, Denying and Detecting. Retrieved April 20, 2016.', 'source_name': 'University of Birmingham C2', 'url': 'https://arxiv.org/ftp/arxiv/papers/1408/1408.1136.pdf'}]","identity--c78cb6e5-0c4b-4611-8297-d1b8b55e40b5","2.1","2.1.0","['enterprise-attack']","identity--c78cb6e5-0c4b-4611-8297-d1b8b55e40b5","1.0"
"course-of-action","course-of-action--ac008435-af58-4f77-988a-c9b96c5920f5","2018-04-18T17:59:24.739Z","2018-04-18T17:59:24.739Z","NTFS File Attributes Mitigation","It may be difficult or inadvisable to block access to EA and ADSs. (Citation: Microsoft ADS Mar 2014) (Citation: Symantec ADS May 2009) Efforts should be focused on preventing potentially malicious software from running. Identify and block potentially malicious software that may contain functionality to hide information in EA and ADSs by using whitelisting (Citation: Beechey 2010) tools like AppLocker (Citation: Windows Commands JPCERT) (Citation: NSA MS AppLocker) or Software Restriction Policies (Citation: Corio 2008) where appropriate. (Citation: TechNet Applocker vs SRP)

Consider adjusting read and write permissions for NTFS EA, though this should be tested to ensure routine OS operations are not impeded. (Citation: InsiderThreat NTFS EA Oct 2017)","[{'url': 'https://attack.mitre.org/wiki/Technique/T1096', 'source_name': 'mitre-attack', 'external_id': 'T1096'}, {'description': 'Beechey, J. (2010, December). Application Whitelisting: Panacea or Propaganda?. Retrieved November 18, 2014.', 'source_name': 'Beechey 2010', 'url': 'http://www.sans.org/reading-room/whitepapers/application/application-whitelisting-panacea-propaganda-33599'}, {'description': 'Tomonaga, S. (2016, January 26). Windows Commands Abused by Attackers. Retrieved February 2, 2016.', 'source_name': 'Windows Commands JPCERT', 'url': 'http://blog.jpcert.or.jp/2016/01/windows-commands-abused-by-attackers.html'}, {'description': 'NSA Information Assurance Directorate. (2014, August). Application Whitelisting Using Microsoft AppLocker. Retrieved March 31, 2016.', 'source_name': 'NSA MS AppLocker', 'url': 'https://www.iad.gov/iad/library/ia-guidance/tech-briefs/application-whitelisting-using-microsoft-applocker.cfm'}, {'description': 'Corio, C., & Sayana, D. P. (2008, June). Application Lockdown with Software Restriction Policies. Retrieved November 18, 2014.', 'source_name': 'Corio 2008', 'url': 'http://technet.microsoft.com/en-us/magazine/2008.06.srp.aspx'}, {'description': 'Microsoft. (2012, June 27). Using Software Restriction Policies and AppLocker Policies. Retrieved April 7, 2016.', 'source_name': 'TechNet Applocker vs SRP', 'url': 'https://technet.microsoft.com/en-us/library/ee791851.aspx'}, {'description': 'Marlin, J. (2013, March 24). Alternate Data Streams in NTFS. Retrieved March 21, 2018.', 'source_name': 'Microsoft ADS Mar 2014', 'url': 'https://blogs.technet.microsoft.com/askcore/2013/03/24/alternate-data-streams-in-ntfs/'}, {'description': 'Pravs. (2009, May 25). What you need to know about alternate data streams in windows? Is your Data secure? Can you restore that?. Retrieved March 21, 2018.', 'source_name': 'Symantec ADS May 2009', 'url': 'https://www.symantec.com/connect/articles/what-you-need-know-about-alternate-data-streams-windows-your-data-secure-can-you-restore'}, {'description': 'Sander, J. (2017, October 12). Attack Step 3: Persistence with NTFS Extended Attributes – File System Attacks. Retrieved March 21, 2018.', 'source_name': 'InsiderThreat NTFS EA Oct 2017', 'url': 'https://blog.stealthbits.com/attack-step-3-persistence-ntfs-extended-attributes-file-system-attacks'}]","identity--c78cb6e5-0c4b-4611-8297-d1b8b55e40b5","2.1","2.1.0","['enterprise-attack']","identity--c78cb6e5-0c4b-4611-8297-d1b8b55e40b5","1.0"
"course-of-action","course-of-action--624d063d-cda8-4616-b4e4-54c04e427aec","2018-04-18T17:59:24.739Z","2018-04-18T17:59:24.739Z","Netsh Helper DLL Mitigation","Identify and block potentially malicious software that may persist in this manner by using whitelisting (Citation: Beechey 2010) tools capable of monitoring DLL loads by Windows utilities like AppLocker. (Citation: Windows Commands JPCERT) (Citation: NSA MS AppLocker)","[{'url': 'https://attack.mitre.org/wiki/Technique/T1128', 'source_name': 'mitre-attack', 'external_id': 'T1128'}, {'description': 'Beechey, J. (2010, December). Application Whitelisting: Panacea or Propaganda?. Retrieved November 18, 2014.', 'source_name': 'Beechey 2010', 'url': 'http://www.sans.org/reading-room/whitepapers/application/application-whitelisting-panacea-propaganda-33599'}, {'description': 'Tomonaga, S. (2016, January 26). Windows Commands Abused by Attackers. Retrieved February 2, 2016.', 'source_name': 'Windows Commands JPCERT', 'url': 'http://blog.jpcert.or.jp/2016/01/windows-commands-abused-by-attackers.html'}, {'description': 'NSA Information Assurance Directorate. (2014, August). Application Whitelisting Using Microsoft AppLocker. Retrieved March 31, 2016.', 'source_name': 'NSA MS AppLocker', 'url': 'https://www.iad.gov/iad/library/ia-guidance/tech-briefs/application-whitelisting-using-microsoft-applocker.cfm'}]","identity--c78cb6e5-0c4b-4611-8297-d1b8b55e40b5","2.1","2.1.0","['enterprise-attack']","identity--c78cb6e5-0c4b-4611-8297-d1b8b55e40b5","1.0"
